"Accurately Modeling the Resting Brain Functional Correlations Using Wave Equation With Spatiotemporal Varying Hypergraph Laplacian","Y. Wang; J. Ma; X. Chen; B. Liu","College of Control Science and Engineering, China University of Petroleum (East China), Qingdao, China; College of Control Science and Engineering, China University of Petroleum (East China), Qingdao, China; Institute of Digital Medicine and Computer-Assisted Surgery, Qingdao University, Qingdao, China; College of Control Science and Engineering, China University of Petroleum (East China), Qingdao, China","IEEE Transactions on Medical Imaging","2 Dec 2022","2022","41","12","3787","3798","How spontaneous brain neural activities emerge from the underlying anatomical architecture, characterized by structural connectivity (SC), has puzzled researchers for a long time. Over the past decades, much effort has been directed toward the graph modeling of SC, in which the brain SC is generally considered as relatively invariant. However, the graph representation of SC is unable to directly describe the connections between anatomically unconnected brain regions and fail to model the negative functional correlations. Here, we extend the static graph model to a spatiotemporal varying hypergraph Laplacian diffusion (STV-HGLD) model to describe the propagation of the spontaneous neural activity in human brain by incorporating the Laplacian of the hypergraph representation of the structural connectome ( ${h}$ SC) into the regular wave equation. Theoretical solution shows that the dynamic functional couplings between brain regions fluctuate in the form of an exponential wave regulated by the spatiotemporal varying Laplacian of  ${h}$ SC. Empirical study suggests that the cortical wave might give rise to resonance with SC during the self-organizing interplay between excitation and inhibition among brain regions, which orchestrates the cortical waves propagating with harmonics emanating from the  ${h}$ SC while being bound by the natural frequencies of SC. Besides, the average statistical dependencies between brain regions, normally defined as the functional connectivity (FC), arises just at the moment before the cortical wave reaches the steady state after the wave spreads across all the brain regions. Comprehensive tests on four extensively studied empirical brain connectome datasets with different resolutions confirm our theory and findings.","1558-254X","","10.1109/TMI.2022.3196007","National Natural Science Foundation of China(grant numbers:62072468); ","https://ieeexplore.ieee.org/stamp/stamp.jsp?arnumber=9849026","Brain connectivity;structure-function relation;spatiotemporal varying hypergraph Laplacian;wave equation;resonance","Brain modeling;Laplace equations;Correlation;Mathematical models;Propagation;Predictive models;Neural activity","brain;graph theory;neurophysiology;spatiotemporal phenomena;statistical analysis;wave equations","anatomical architecture;anatomically unconnected brain regions;brain structural connectivity;cortical wave;dynamic functional couplings;empirical brain connectome datasets;exponential wave;functional connectivity;graph representation;human brain;hypergraph representation;negative functional correlations;regular wave equation;resting brain functional correlations;spatiotemporal varying hypergraph Laplacian diffusion model;spatiotemporal varying Laplacian ofhSC;spontaneous brain neural activities;static graph model;statistical dependence","Humans;Magnetic Resonance Imaging;Connectome;Brain;Rest;Diffusion;Nerve Net","","","44","IEEE","3 Aug 2022","","","IEEE","IEEE Journals"
"Identification of significant metabolic markers from MRSI data for brain cancer classification","M. G. Kounelakis; M. E. Zervakis; M. E. Blazadonakis; G. J. Postma; L. M. C. Buydens; A. Heerschap; X. Kotsiakis","Department of Electronic and Computer Engineering, Technical University of Crete, Greece; Department of Electronic and Computer Engineering, Technical University of Crete, Greece; Department of Electronic and Computer Engineering, Technical University of Crete, Greece; Department of Analytical Chemistry, Radboud University, Netherlands; Department of Analytical Chemistry, Radboud University, Netherlands; Department of Radiology, University Medical Center Nijmegen, Netherlands; Department of Neurosurgery, General Hospital of Chania, Greece","2008 8th IEEE International Conference on BioInformatics and BioEngineering","8 Dec 2008","2008","","","1","6","Investigation of the significance of metabolites peak area ratios derived from brain magnetic resonance spectroscopic imaging (MRSI) spectra, in brain tumors classification, has been applied. Results have shown that in most binary classifications using SVM and LSSVM classifiers, the accuracy achieved was greater than 0.90 AUC except the case of Gliomas grade 2 vs Gliomas grade 3 where 0.84 AUC was recorded due to the great heterogeneity of these two types of tumor. The minimum but also biologically significant set of features (markers), where maximum AUCs recorded, was derived. Ratios of N-acetyl-aspartate, choline, creatine and lipids metabolites found to play the most crucial role in brain tumors discrimination. The biological importance of these markers was also verified by literature. Finally the influence of four magnetic resonance image (MRI) intensities on the classification process was also measured. It was found that MRI data do not improve significantly the classification accuracies.","","978-1-4244-2844-1","10.1109/BIBE.2008.4696668","","https://ieeexplore.ieee.org/stamp/stamp.jsp?arnumber=4696668","","Cancer;Neoplasms;Spectroscopy;Magnetic resonance;Magnetic resonance imaging;Brain;Surgery;Lesions;Protons;Area measurement","biochemistry;biomedical MRI;brain;cancer;image classification;medical image processing;support vector machines;tumours","metabolic markers identification;brain cancer classification;magnetic resonance spectroscopic imaging;MRSI data;brain tumor classification;SVM;LSSVM classifiers;N-acetyl-aspartate;choline;creatine;lipids metabolites;brain tumors discrimination;magnetic resonance image intensities;MRI data;gliomas grade 2;gliomas grade 3","","2","","13","IEEE","8 Dec 2008","","","IEEE","IEEE Conferences"
"Functional brain imaging of speech perception via electrical stimulation","E. A. Tobey; M. D. Devous; P. S. Roland","Callier Advanced Hearing Research Center, University of Texas, Dallas, TX, USA; Nuclear Medicine Center, University of Technology, TX, USA; Department of Otolaryngology-Head and Neck Surgery, University of Texas Southwestern Medical Centre, TX, USA","Proceedings of the 25th Annual International Conference of the IEEE Engineering in Medicine and Biology Society (IEEE Cat. No.03CH37439)","5 Apr 2004","2003","3","","1991","1994 Vol.3","In order to examine factors contributing to speech perception performance variations in cochlear implant users, single photon emission computed tomography (SPECT) was used to examine cortical activity (regional cerebral blood flow, rCBF) elicited by the electrical stimulation of multichannel cochlear implants. Normal hearing (N = 9) and cochlear implant (N = 8) subjects watched a 15 minute video-taped story under two conditions: audio presented monaurally to the left ear (implanted for cochlear implant subjects), and a visual only presentation. Left monaural stimulation in normal hearing subjects produced significant bilateral activation of Brodmann areas 41, 42, 22, 21, and 38. Cochlear implant subjects with relatively high levels of open-set speech perception demonstrated bilateral activation of cortex; however, the extent of activation was significantly less than that observed for normal hearing individuals, particularly in auditory association cortex (Brodmann areas 22, 21, 38). Individuals with minimal open set speech perception scores demonstrated unilateral activation of the cortex on the hemisphere contralateral to the ear of implantation, with minimal auditory association cortex activation.","1094-687X","0-7803-7789-3","10.1109/IEMBS.2003.1280123","","https://ieeexplore.ieee.org/stamp/stamp.jsp?arnumber=1280123","","Brain;Speech;Electrical stimulation;Cochlear implants;Auditory system;Filters;Deafness;Electrodes;Biomedical imaging;Surgery","single photon emission computed tomography;brain;ear;hearing aids;hearing;medical image processing;blood flow measurement;speech;neurophysiology","functional brain imaging;speech perception;electrical stimulation;cochlear implant users;single photon emission computed tomography;SPECT;cortical activity;regional cerebral blood flow;Brodmann areas","","","","11","IEEE","5 Apr 2004","","","IEEE","IEEE Conferences"
"Characterization of cortical motor function and imagery-related cortical activity: Potential application for prehabilitation","M. Korostenskaja; C. Kapeller; K. H. Lee; C. Guger; J. Baumgartner; E. M. Castillo; M. Korostenskaja; M. Korostenskaja; E. M. Castillo; M. Korostenskaja; K. H. Lee; J. Baumgartner; E. M. Castillo; C. Kapeller; C. Guger","Florida Epilepsy Center Florida Hospital, Orlando, USA; G.tec Guger Technologies OG, Schiedlberg, Austria; Florida Epilepsy Center Florida Hospital, Orlando, USA; G.tec Guger Technologies OG, Schiedlberg, Austria; Florida Epilepsy Center Florida Hospital, Orlando, USA; Florida Epilepsy Center Florida Hospital, Orlando, USA; Florida Epilepsy Center Florida Hospital, Orlando, USA; Florida Epilepsy Center Florida Hospital, Orlando, USA; MEG Center, Florida Hospital for Children, Orlando, USA; Florida Epilepsy Center Florida Hospital, Orlando, USA; Florida Epilepsy Center, Florida Hospital, Orlando, USA; Florida Epilepsy Center Florida Hospital, Orlando, USA; Florida Epilepsy Center, Florida Hospital, Orlando, USA; G.tec Guger Technologies OG, Schiedlberg, Austria; G.tec Guger Technologies OG, Schiedlberg, Austria","2017 IEEE International Conference on Systems, Man, and Cybernetics (SMC)","30 Nov 2017","2017","","","3014","3019","To minimize functional morbidity associated with brain surgery, new preventive approaches (also referred to as ""prehabilitation"") by using motor-imagery-based computer interfaces (MI-BCIs) can be utilized. To achieve successful MI-BCI performance for prehabilitation purposes, the characteristics of an electrocorticographic (ECoG) signal that is associated with overt motor function (""real movement"" - RM) versus covert motor function (""motor imagery"" - MI) need to be determined. In our current study, 5 patients with pharmacoresistant epilepsy (2 males, average age 25 years, SD 15), undergoing evaluation for epilepsy surgery participated in both RM and MI tasks. Although the RM- and MI-related ECoG changes had some common features, they also differed in a number of ways, such as location, frequency ranges, signal synchronization and desynchronization. These similarities and differences are discussed in a view of other neuroimaging studies, including magnetoencephalography (MEG) and functional magnetic resonance imaging (fMRI). We emphasize the need for inclusion of a broad spectrum of frequencies in ECoG analysis, when RM- and MI-related activities are concerned.","","978-1-5386-1645-1","10.1109/SMC.2017.8123087","","https://ieeexplore.ieee.org/stamp/stamp.jsp?arnumber=8123087","brain-computer interfaces (BCIs);brain surgery;electrocorticography (ECoG);epilepsy surgery;functional mapping;motor function;motor imagery;motor-imagery-based BCIs (MI-BCIs);motor rehabilitation;prehabilitation;tumor surgery","Surgery;Epilepsy;Synchronization;Tumors;Frequency synchronization;Hospitals","bioelectric potentials;brain-computer interfaces;electroencephalography;medical disorders;medical signal processing;neurophysiology;patient rehabilitation;surgery","cortical motor function;brain surgery;prehabilitation purposes;electrocorticographic signal;overt motor function;pharmacoresistant epilepsy;epilepsy surgery;MI tasks;signal synchronization;functional magnetic resonance imaging;ECoG analysis;magnetoencephalography;neuroimaging studies;signal desynchronization;motor-imagery-based computer interfaces;imagery-related cortical activity","","1","","30","IEEE","30 Nov 2017","","","IEEE","IEEE Conferences"
"Fresh Brain Tissue Diagnostics Using Raman Spectroscopy in Humans","B. Broadbent; M. A. Brusatori; K. Koya; L. M. Scarpace; S. N. Kalkanis; G. W. Auner","Department of Smart Sensors and Integrated Microsystems Program, Wayne State University, Detroit, MI, USA; Department of Smart Sensors and Integrated Microsystems Program, Wayne State University, Detroit, MI, USA; Department of Smart Sensors and Integrated Microsystems Program, Wayne State University, Detroit, MI, USA; Department of Neurosurgery, Hermelin Brain Tumor Center, Detroit, MI, USA; Department of Neurosurgery, Hermelin Brain Tumor Center, Detroit, MI, USA; Department of Smart Sensors and Integrated Microsystems Program, Wayne State University, Detroit, MI, USA","2018 IEEE International Conference on Electro/Information Technology (EIT)","21 Oct 2018","2018","","","0394","0398","A key part of treatment for brain tumors is tumor resection, the amount of tumor resection has a direct correlation on the mortality of the patient. However, tools available to surgeons to ensure maximal resection while preserving a patient's functional status often increase surgery time or are lacking in accuracy. Raman spectroscopy is a promising modality that can provide real time intraoperative data to the surgeon about whether a tissue is normal or cancerous, thus aiding the surgeon in obtaining maximal safe resection. In this paper, we pair Raman spectroscopy with a supervised machine learning technique, support vector machine, to classify fresh tissue samples as solid tumor, infiltrating tumor, necrosis, or normal brain tissue. The support vector machine classifier resulted in 89% accuracy of the 117 tissue samples while delivering real time results. Accurate real-time tissue characterization will vastly reduce the amount of time a surgeon waits for the results of biopsies and provides a means for intraoperative margin assessment during tumor resection.","2154-0373","978-1-5386-5398-2","10.1109/EIT.2018.8500109","","https://ieeexplore.ieee.org/stamp/stamp.jsp?arnumber=8500109","","Tumors;Lipidomics;Surgery;Raman scattering;Support vector machines;Solids;Brain","biomedical optical imaging;brain;cancer;learning (artificial intelligence);medical image processing;Raman spectroscopy;support vector machines;surgery;tumours","fresh tissue samples;solid tumor;infiltrating tumor;normal brain tissue;support vector machine classifier;time results;accurate real-time tissue characterization;surgeon;tumor resection;fresh brain tissue diagnostics;brain tumors;maximal resection;surgery time;time intraoperative data;maximal safe resection;pair Raman spectroscopy;supervised machine learning technique;tissue samples","","","","36","IEEE","21 Oct 2018","","","IEEE","IEEE Conferences"
"Electrocorticographic spectral changes associated with ipsilateral individual finger and whole hand movement","S. Zanos; K. J. Miller; J. G. Ojemann","Department of Physiology and Biophysics, University of Washington School of Medicine, Seattle, WA, USA; Department of Physics, University of Washington, Seattle, WA, USA; Department of Neurological Surgery, University of Washington School of Medicine, Seattle, WA, USA","2008 30th Annual International Conference of the IEEE Engineering in Medicine and Biology Society","14 Oct 2008","2008","","","5939","5942","The study of the human sensorimotor (SM) cortex activations associated with hand motor movement is central to the design of efficient and clinically useful brain-computer interfaces. Whereas the electrocorticographic (ECoG) signatures of contralateral hand movement have been studied in detail, those of ipsilateral hand and individual finger movements have not been characterized. We studied the low (8–32 Hz) and high-frequency (76–100 Hz) SM cortical ECoG spectral changes associated with contralateral and ipsilateral whole hand and individual finger movement and assessed their discriminability. We find that ipsilateral movement is associated with widespread decreases in the low-frequency band (LFB) and more focal increases in the high-frequency band (HFB). The HFB component discriminates between ipsilateral and contralateral movement-associated activations, in contrast to the LFB. The HFB also discriminates between thumb and index finger movement-associated activations, for both the contralateral and the ipsilateral case, whereas the LFB does not. This is the first published report of a discriminable ipsilateral motor signal, with important implications in the use of brain-computer interfaces in hemiplegic patients.","1558-4615","978-1-4244-1814-5","10.1109/IEMBS.2008.4650569","","https://ieeexplore.ieee.org/stamp/stamp.jsp?arnumber=4650569","","","","","Adult;Algorithms;Brain Mapping;Electroencephalography;Epilepsy;Evoked Potentials, Motor;Fingers;Hand;Humans;Male;Motor Cortex;Movement;Signal Processing, Computer-Assisted","7","1","9","IEEE","14 Oct 2008","","","IEEE","IEEE Conferences"
"Evaluation of Simple Algorithms for Spectral Parameter Analysis of the Electroencephalogram","W. D. Smith; D. L. Lager","California State University, Sacramento, CA, USA; Electronics Engineering Department, Lawrence Livermore National Laboratory, University of California, Livermore, CA, USA","IEEE Transactions on Biomedical Engineering","12 Mar 2007","1986","BME-33","3","352","358","Simple autoregressive moving-average (ARMA) and autoregressive (AR) algorithms were tested for use in spectral parameter analysis (SPA) of the background electroencephalogram (EEG). In studies on simulated EEG, both algorithms successfully extracted estimates of the spectral component parameters, and their performance was relatively independent of assumed model order. The ARMA algorithm was unbiased. The AR algorithm, though biased, was simpler and more precise and, thus, may be the most suitable for on-line use. The test results on simulated data were supported by the successful application of the algorithms to human EEG recorded during surgery.","1558-2531","","10.1109/TBME.1986.325721","","https://ieeexplore.ieee.org/stamp/stamp.jsp?arnumber=4122287","","Spectral analysis;Algorithm design and analysis;Electroencephalography;Brain modeling;Testing;Frequency;Iterative algorithms;Surgery;Biomedical engineering;Autocorrelation","","","Electroencephalography;Models, Neurological","14","","26","IEEE","12 Mar 2007","","","IEEE","IEEE Journals"
"Review On Brain Tumor Malignancy Prediction By 3D Reconstruction","K. C. Manoj; A. S. Dhas","Electronics and Communication Engineering, Vimal Jyothi Engineering College, Kannur, India; Electronics and Communication Engineering, Vimal Jyothi Engineering College, Kannur, India","2021 2nd International Conference on Advances in Computing, Communication, Embedded and Secure Systems (ACCESS)","20 Oct 2021","2021","","","274","280","A major increase in brain tumor has been seen in recent years, and it is in the tenth position. It is sever type of cancer and influences in people of all ages. Hence, if diagnosed well at the initial stage, it will turn out to be one of the most curable types of tumors. The computer aided analysis of MRI is performed to diagnosis the tumor through the process of classifying and segmenting. From the previous years of study, the research areas are mainly concentrated on machine and deep learning for brain malignancy prediction and treatment. The two dimensional MRI images helps to detect and classify the brain cancer precisely and efficiently. Usually the MRI images are two dimensional and not give sufficient knowledge regarding the structure and exact size of the tumor can be removed, and the detection procedure has become more complex. Since two-dimensional images never offer the actual feeling of exactly how a tumor looks, diagnosis includes 3D tumor reconstruction, planning for surgery and biological studies. The survival rate shows gives us an exact picture of the number of patients who have survived after the tumor is identified. The 5-year and 10 year survival rate is approximately 36 percent and 31 percent respectively for persons with a cancerous brain or CNS tumor. For increasing the survival rate of brain tumor, 3D image reconstruction can be used and it is one of the best attractive features in virtual reality, especially because of its application in medical image processing.","","978-1-7281-7136-4","10.1109/ACCESS51619.2021.9563299","","https://ieeexplore.ieee.org/stamp/stamp.jsp?arnumber=9563299","Brain cancer;MRI;Machine Learning;Deep Learning","Deep learning;Image segmentation;Three-dimensional displays;Magnetic resonance imaging;Surgery;Virtual reality;Task analysis","biomedical MRI;brain;cancer;image reconstruction;learning (artificial intelligence);medical image processing;surgery;tumours;virtual reality","two-dimensional images;cancerous brain;CNS tumor;3D image reconstruction;brain tumor malignancy prediction;brain malignancy prediction;dimensional MRI images;brain cancer;3D tumor reconstruction;virtual reality;medical image processing","","","","54","IEEE","20 Oct 2021","","","IEEE","IEEE Conferences"
"Deep brain stimulation efficiency and Parkinson's disease stage prediction using Markov models","O. Geman; I. Chiuchisan","Integrated Center for Research Development and Innovation in Advanced Materials, Nanotechnologies, and Distributed Systems for Fabrication and Control, “Stefan cel Mare” University, USV, Suceava, Romania; Integrated Center for Research Development and Innovation in Advanced Materials, Nanotechnologies, and Distributed Systems for Fabrication and Control, “Stefan cel Mare” University, USV, Suceava, Romania","2015 E-Health and Bioengineering Conference (EHB)","28 Jan 2016","2015","","","1","4","The Parkinson's disease is a neurodegenerative disease that occurs due to loss of a neurotransmitter called dopamine, leading to slow and inexorable destruction of neurons. Deep Brain Stimulation (DBS) may be used for patients with Parkinson's disease (PD) in order to control the tremor symptom. Studies show that after 15, 30, 45, 60 minutes or even longer (3 or 6 months), but over time, the tremor symptom reappears and the Deep Brain Stimulation procedure has to be restarted. A general purpose model of Parkinson's disease prognosis based on Markov process is described in this paper. The paper presents the mathematical tool that can be used to generate accurate assessments of Parkinson's disease stage and the DBS effects in time, and can be applicable in medical screening for patients with Parkinson's disease.","","978-1-4673-7545-0","10.1109/EHB.2015.7391433","","https://ieeexplore.ieee.org/stamp/stamp.jsp?arnumber=7391433","Parkinson's disease;Deep Brain Stimulation;Markov Models;Prediction","Satellite broadcasting;Markov processes;Parkinson's disease;Medical diagnostic imaging;Brain stimulation;Partial discharges","brain;diseases;Markov processes;neurophysiology;surgery","medical screening;DBS effects;mathematical tool;tremor symptom;inexorable neuron destruction;dopamine;neurotransmitter;neurodegenerative disease;Markov models;Parkinson's disease stage prediction;deep brain stimulation efficiency;time 15 min to 6 month","","1","","27","IEEE","28 Jan 2016","","","IEEE","IEEE Conferences"
