"A Parametric Simulation of Neuronal Noise From Microelectrode Recordings","K. J. Weegink; P. A. Bellette; J. J. Varghese; P. A. Silburn; P. A. Meehan; A. P. Bradley","School of Mechanical and Mining Engineering, University of Queensland, St. Lucia, Queensland, Australia; School of Mechanical and Mining Engineering, University of Queensland, St. Lucia, Queensland, Australia; School of Mechanical and Mining Engineering, University of Queensland, St. Lucia, Queensland, Australia; UQ Centre for Clinical Research, The University of Queensland, Brisbane, Queensland, Australia; School of Mechanical and Mining Engineering, University of Queensland, St. Lucia, Queensland, Australia; School of Information Technology and Electrical Engineering, University of Queensland, St. Lucia, Queensland, Australia","IEEE Transactions on Neural Systems and Rehabilitation Engineering","27 Jan 2017","2017","25","1","4","13","In this paper we present an efficient model of microelectrode recordings (MER) from the subthalamic nucleus acquired during deep brain stimulation (DBS) surgery. The model shows how changes in the “noise” relate to the neuronal spike time statistics. A top-down approach is used with analysis-by-synthesis of the MER power spectra. The model is built around a sum of filtered point processes consisting of thousands of neurons and including extracellular filtering. The quality of the model is demonstrated through comparisons to recordings from eight individuals (both hemispheres in six) who have undergone DBS implantation for the treatment of Parkinson's disease. The simulated recordings were compared using their voltage amplitude distributions, power spectral density estimates and phase synchrony while varying only one free parameter (the shape of the inter-spike interval distribution). Through this simple model, we show that the noise present in a DBS MER contains properties that match that of patient recordings when a Weibull distribution with shape parameter of 0.8 is used for the inter-spike interval.","1558-0210","","10.1109/TNSRE.2016.2573318","Australian Postgraduate Award; Australian Research Council Future Fellowship(grant numbers:FT110100623); The University of Queensland and Medtronics; ","https://ieeexplore.ieee.org/stamp/stamp.jsp?arnumber=7480817","Deep brain stimulation (DBS);filtered point process;microelectrode;microelectrode recordings (MER);subthalamic nucleus (STN)","Computational modeling;Electrodes;Extracellular;Satellite broadcasting;Biological system modeling;Adaptation models","biomedical electrodes;brain;diseases;microelectrodes;neurophysiology;statistics;surgery;Weibull distribution","interspike interval;shape parameter;Weibull distribution;DBS MER;phase synchrony;power spectral density estimates;voltage amplitude distribution;Parkinson's disease treatment;DBS implantation;extracellular filtering;filtered point processes;MER power spectra;analysis-by-synthesis;top-down approach;neuronal spike time statistics;deep brain stimulation surgery;subthalamic nucleus;microelectrode recordings;neuronal noise;parametric simulation","Action Potentials;Adult;Artifacts;Computer Simulation;Electrocorticography;Equipment Design;Equipment Failure Analysis;Humans;Microelectrodes;Models, Neurological;Models, Statistical;Neurons;Reproducibility of Results;Sensitivity and Specificity;Signal-To-Noise Ratio;Subthalamic Nucleus","2","","35","IEEE","30 May 2016","","","IEEE","IEEE Journals"
"Noninvasive Noncontact 3D Optical Imaging of Blood Flow Distributions in Animals and Humans","S. Mazdeyasna; C. Huang; M. Zhoa; A. R. Bonaroti; K. Saatman; L. Chen; E. G. A. Jawdeh; H. S. Bada; B. A. Miller; L. Wong; G. Yu","F. Joseph Halcomb III, M.D., University of Kentucky, Lexington, Kentucky, USA; F. Joseph Halcomb III, M.D., University of Kentucky, Lexington, Kentucky, USA; F. Joseph Halcomb III, M.D., University of Kentucky, Lexington, Kentucky, USA; Division of Plastic Surgery, University of Kentucky, Lexington, Kentucky, USA; Department of Physiology, University of Kentucky, Lexington, Kentucky, USA; Department of Physiology, Spinal Cord and Brain Injury Research Center, Lexington, Kentucky, USA; Department of Pediatrics, University of Kentucky, Lexington, Kentucky, USA; Department of Pediatrics, University of Kentucky, Lexington, Kentucky, USA; Department of Neurosurgery, University of Kentucky, Lexington, Kentucky, USA; Division of Plastic Surgery, University of Kentucky, Lexington, Kentucky, USA; F. Joseph Halcomb III, M.D., University of Kentucky, Lexington, Kentucky, USA","2018 IEEE International Symposium on Signal Processing and Information Technology (ISSPIT)","17 Feb 2019","2018","","","441","446","We modified and adapted a novel noncontact speckle contrast diffuse correlation tomography (scDCT) system, developed in our laboratory, for noninvasive 3D imaging of blood flow distributions in small animals and large human tissue volumes. The new system has the flexibility of selecting small and large regions of interest (ROIs) with different imaging depths for the use in both the small mouse head and large human mastectomy skin flaps. The capability of the upgraded scDCT system was demonstrated by continuous imaging of cerebral blood flow (CBF) changes in a small mouse head during sequential common carotid artery ligations and blood flow distributions in human mastectomy skin flaps during surgery. As expected, arterial occlusions resulted in substantial CBF decreases in deep brain tissues of the mouse. Spatial heterogeneity existed, and lower blood flow values were observed around the incision area of mastectomy skin flaps. The noncontact scDCT system with flexible ROIs and imaging depths has the potential to be used in many preclinical and clinical settings for noninvasive assessment of tissue hemodynamics and viability.","2162-7843","978-1-5386-7568-7","10.1109/ISSPIT.2018.8642638","","https://ieeexplore.ieee.org/stamp/stamp.jsp?arnumber=8642638","speckle contrast diffuse correlation tomography;blood flow imaging;mouse brain;human mastectomy skin flap","Imaging;Skin;Mice;Geometry;Image reconstruction;Three-dimensional displays;Blood flow","biomedical optical imaging;blood flow measurement;blood vessels;brain;optical tomography;skin","blood flow distributions;human tissue volumes;mouse head;human mastectomy skin flaps;upgraded scDCT system;continuous imaging;cerebral blood flow changes;sequential common carotid artery ligations;noncontact scDCT system;noninvasive 3D imaging;3D noninvasive noncontact optical imaging;speckle contrast diffuse correlation tomography system;tissue hemodynamics;tissue viability","","","","27","IEEE","17 Feb 2019","","","IEEE","IEEE Conferences"
"Detection of Subthalamic Nucleus using Time-Frequency Features of Microelectrode recordings and Random Forest Classifier","P. A. Karthick; K. R. Wan; R. Yuvaraj; A. A. See; N. K. K. King; J. Dauwels","Department of Instrumentation and Control Engineering, NIT, Tiruchirappalli, India; Department of Neurosurgery, National Neuroscience Institute and Department of Neurosurgery, Singapore General Hospital, Singapore; School of Electrical and Electronic Engineering, Nanyang Technological University, Singapore; Department of Neurosurgery, National Neuroscience Institute and Department of Neurosurgery, Singapore General Hospital, Singapore; Department of Neurosurgery, National Neuroscience Institute and Department of Neurosurgery, Singapore General Hospital, Singapore; School of Electrical and Electronic Engineering, Nanyang Technological University, Singapore","2019 41st Annual International Conference of the IEEE Engineering in Medicine and Biology Society (EMBC)","7 Oct 2019","2019","","","4164","4167","Accurate localization of subthalamic nucleus (STN) is a key prior in deep brain stimulation (DBS) surgery for the patients with advanced Parkinson's disease (PD). Microelectrode recordings (MERs) along with preplanned trajectories are often employed for the STN localization and it remains challenging task. These MER signals are nonstationary and multicomponent in nature. In this study, we propose a system based on time-frequency features of MERs to differentiate the STN and non-STN regions. We assessed the system with 50 MER trajectories from 26 PD patients who have undergone DBS surgery. The signals are pre-processed and subjected to six-level wavelet decomposition. Then, the entropy is computed from the detailed and approximate coefficients. These features are fed to the random forest classifier and the model is evaluated by leave one patient out cross-validation. The results show that entropy associated with detailed wavelet coefficients (D1and D2) are higher in STN where as it is lower in other wavelet scales. All extracted features except entropy from approximate coefficients are found to have significant difference between non-STN and STN (p<; 0.05). The random forest classifier achieves about 83% accuracy and 87% precision in differentiating the STN and non-STN regions.","1558-4615","978-1-5386-1311-5","10.1109/EMBC.2019.8857080","","https://ieeexplore.ieee.org/stamp/stamp.jsp?arnumber=8857080","","Entropy;Surgery;Trajectory;Time-frequency analysis;Satellite broadcasting;Feature extraction;Diseases","bioelectric phenomena;biomedical electrodes;brain;diseases;entropy;feature extraction;medical signal processing;microelectrodes;neurophysiology;signal classification;surgery;wavelet transforms","MER trajectories;advanced Parkinson's disease;key prior in deep brain stimulation surgery;microelectrode recordings;subthalamic nucleus;detailed wavelet coefficients;leave one patient;random forest classifier;approximate coefficients;detailed coefficients;six-level wavelet decomposition;DBS surgery;PD patients;nonSTN regions;time-frequency features;MER signals;STN localization;preplanned trajectories","Deep Brain Stimulation;Humans;Microelectrodes;Parkinson Disease;Subthalamic Nucleus","4","","16","IEEE","7 Oct 2019","","","IEEE","IEEE Conferences"
"Modeling of Brain Tissue Heating Caused by Direct Cortical Stimulation for Assessing the Risk of Thermal Damage","J. Vrba; R. Janca; M. Blaha; P. Jezdik; A. Belohlavkova; P. Krsek; D. Vrba","Department of Biomedical Technology, Faculty of Biomedical Engineering, Czech Technical University in Prague, Prague, Czech Republic; Department of Circuit Theory, Faculty of Electrical Engineering, Czech Technical University in Prague, Prague, Czech Republic; Department of Circuit Theory, Faculty of Electrical Engineering, Czech Technical University in Prague, Prague, Czech Republic; Department of Circuit Theory, Faculty of Electrical Engineering, Czech Technical University in Prague, Prague, Czech Republic; Department of Pediatric Neurology, 2nd Faculty of Medicine, Charles University in Prague, Motol University Hospital, Prague, Czech Republic; Department of Pediatric Neurology, 2nd Faculty of Medicine, Charles University in Prague, Motol University Hospital, Prague, Czech Republic; Department of Biomedical Technology, Faculty of Biomedical Engineering, Czech Technical University in Prague, Prague, Czech Republic","IEEE Transactions on Neural Systems and Rehabilitation Engineering","22 Mar 2019","2019","27","3","440","449","This paper aims to employ the numerical simulations to assess the risk of cellular damage during the application of a novel paradigm of electrical stimulation mapping (ESM) used in neurosurgery. The core principle of the paradigm is the use of short, high-intensity and high-frequency stimulation pulses. We developed a complex numerical model and performed coupled electro-thermal transient simulations. The model was optimized by incorporating ESM electrodes' resistance obtained during multiple intraoperative measurements and validated by comparing them with the results of temperature distribution measurement acquired by thermal imaging. The risk of heat-induced cellular damage was assessed by applying the Arrhenius equation integral on the computed time-dependent spatial distribution of temperature in the brain tissue. Our results suggest that the impact of the temperature increase during our novel ESM paradigm is thermally non-destructive. The presented simulation results match the previously published thermographic measurement and histopathological examination of the stimulated brain tissue and confirm the safety of the novel ESM.","1558-0210","","10.1109/TNSRE.2019.2898253","Ministerstvo Zdravotnictví Ceské Republiky(grant numbers:15-30456A); conceptual development of research organization (Motol University Hospital – FN Motol(grant numbers:00064203-6005); České Vysoké Učení Technické v Praze(grant numbers:SGS15/198/OHK3/3T/13); ","https://ieeexplore.ieee.org/stamp/stamp.jsp?arnumber=8637974","Electrical stimulation;thermal damage;numerical model","Numerical models;Mathematical model;Electrodes;Temperature measurement;Computational modeling;Temperature distribution;Protocols","bioelectric phenomena;biological tissues;biomedical electrodes;biothermics;brain;infrared imaging;neurophysiology;nondestructive testing;numerical analysis;surgery;temperature distribution;temperature measurement","high-frequency stimulation pulses;electro-thermal transient simulations;multiple intraoperative measurements;temperature distribution measurement;thermal imaging;heat-induced cellular damage;Arrhenius equation integral;brain tissue heating;thermal damage;numerical simulations;electrical stimulation mapping;neurosurgery;cortical stimulation;ESM electrodes;numerical model","Algorithms;Body Temperature;Brain;Brain Mapping;Cerebral Cortex;Computer Simulation;Electric Stimulation;Electrodes;Hot Temperature;Humans;Intraoperative Neurophysiological Monitoring;Models, Theoretical;Thermodynamics;Thermography","6","","40","IEEE","8 Feb 2019","","","IEEE","IEEE Journals"
"Decoding semantic information from human electrocorticographic (ECoG) signals","W. Wang; A. D. Degenhart; G. P. Sudre; D. A. Pomerleau; E. C. Tyler-Kabara","Departments of Physical Medicine and Rehabilitation, Bioengineering, and Neurological Surgery, University of Pittsburgh, PA, USA; Departments of Physical Medicine and Rehabilitation, Bioengineering, and Neurological Surgery, University of Pittsburgh, PA, USA; Carnegie Mellon University Program in Neural Computation, PA, USA; Intel Laboratories Pittsburgh, Carnegie Mellon University, PA, USA; Departments of Physical Medicine and Rehabilitation, Bioengineering, and Neurological Surgery, University of Pittsburgh, PA, USA","2011 Annual International Conference of the IEEE Engineering in Medicine and Biology Society","1 Dec 2011","2011","","","6294","6298","This study examined the feasibility of decoding semantic information from human cortical activity. Four human subjects undergoing presurgical brain mapping and seizure foci localization participated in this study. Electrocorticographic (ECoG) signals were recorded while the subjects performed simple language tasks involving semantic information processing, such as a picture naming task where subjects named pictures of objects belonging to different semantic categories. Robust high-gamma band (60-120Hz) activation was observed at the left inferior frontal gyrus (LIFG) and the posterior portion of the superior temporal gyrus (pSTG) with a temporal sequence corresponding to speech production and perception. Furthermore, Gaussian Naïve Bayes and Support Vector Machine classifiers, two commonly used machine learning algorithms for pattern recognition, were able to predict the semantic category of an object using cortical activity captured by ECoG electrodes covering the frontal, temporal and parietal cortices. These findings have implications for both basic neuroscience research and development of semantic-based brain-computer interface systems (BCI) that can help individuals with severe motor or communication disorders to express their intention and thoughts.","1558-4615","978-1-4577-1589-1","10.1109/IEMBS.2011.6091553","","https://ieeexplore.ieee.org/stamp/stamp.jsp?arnumber=6091553","","Semantics;Electrodes;Humans;Decoding;Speech;Support vector machines;Accuracy","Bayes methods;bioelectric phenomena;biomedical electrodes;brain;decoding;Gaussian distribution;medical signal processing;neurophysiology;semantic networks;support vector machines","decoding;electrocorticography;ECoG;human cortical activity;presurgical brain mapping;seizure foci localization;semantic information processing;picture naming task;high-gamma band activation;left inferior frontal gyrus;superior temporal gyrus;Gaussian Naive Bayes classifier;support vector machine;machine learning algorithms;pattern recognition;semantic-based brain-computer interface systems;BCI;severe motor disorder;communication disorder","Adolescent;Adult;Artificial Intelligence;Bayes Theorem;Brain;Brain;Brain Mapping;Child;Communication;Communication Aids for Disabled;Electrodes;Electrophysiology;Epilepsy;Female;Humans;Magnetic Resonance Imaging;Normal Distribution;Signal Processing, Computer-Assisted;User-Computer Interface","11","2","24","IEEE","1 Dec 2011","","","IEEE","IEEE Conferences"
"Feature analysis of functional MRI for discrimination between normal and epileptogenic brain","L. S. Burrell; S. M. Glynn; G. J. Vachtsevanos; B. Litt","Georgia Institute of Technology, Atlanta, GA, USA; Hospital of the University of Pennsylvania, Philadelphia, PA, USA; Georgia Institute of Technology, Atlanta, GA, USA; Hospital of the University of Pennsylvania, Philadelphia, PA, USA","2007 European Control Conference (ECC)","26 Mar 2015","2007","","","2554","2559","Temporal lobe epilepsy (TLE) is the most common epilepsy syndrome in adults. As it is a focal disorder, i.e. limited to a particular area of the brain, it is often curable through surgery when drug therapies fail to control seizures. In order to ensure successful surgical outcome, the abnormal brain regions must be localized as accurately as possible to prevent the removal of healthy tissue. We report on a novel voxel-based procedure for discrimination between normal and epileptogenic brain tissue through feature analysis of continuous arterial spin labeling (ASL) perfusion functional magnetic resonance imaging (fMRI) data. Five TLE patients and three healthy controls were studied. Features were extracted from the fMRI time series of each subject to determine which individual features and combinations of features could correctly separate epileptogenic and normal brain tissue.","","978-3-9524173-8-6","10.23919/ECC.2007.7068386","","https://ieeexplore.ieee.org/stamp/stamp.jsp?arnumber=7068386","Feature extraction;genetic programming;functional magnetic resonance imaging (fMRI)","Feature extraction;Accuracy;Hippocampus;Epilepsy;Blood;Electroencephalography","biological tissues;biomedical MRI;brain;feature extraction;geriatrics;medical disorders;medical image processing;neurophysiology;surgery","feature analysis;temporal lobe epilepsy;adults;epilepsy syndrome;focal disorder;surgery;drug therapy;abnormal brain regions;voxel-based procedure;epileptogenic brain tissue;continuous arterial spin labeling perfusion;functional magnetic resonance imaging data;fMRI data;TLE patients;time series;normal brain tissue","","2","","13","","26 Mar 2015","","","IEEE","IEEE Conferences"
"Bioluminescence Tomography Based on Gaussian Weighted Laplace Prior Regularization for In Vivo Morphological Imaging of Glioma","Y. Gao; K. Wang; S. Jiang; Y. Liu; T. Ai; J. Tian","CAS Key Laboratory of Molecular Imaging, Institute of Automation, Chinese Academy of Sciences, Beijing, China; CAS Key Laboratory of Molecular Imaging, Institute of Automation, Chinese Academy of Sciences, Beijing, China; School of Computer and Information Technology, Beijing Jiaotong University, Beijing, China; School of Computer and Information Technology, Beijing Jiaotong University, Beijing, China; Department of Hepatobiliary Surgery, Southern Medical University, Guangzhou, China; University of Chinese Academy of Sciences, Beijing, China","IEEE Transactions on Medical Imaging","27 Oct 2017","2017","36","11","2343","2354","Bioluminescence tomography (BLT) is a powerful non-invasive molecular imaging tool for in vivo studies of glioma in mice. However, because of the light scattering and resulted ill-posed problems, it is challenging to develop a sufficient reconstruction method, which can accurately locate the tumor and define the tumor morphology in three-dimension. In this paper, we proposed a novel Gaussian weighted Laplace prior (GWLP) regularization method. It considered the variance of the bioluminescence energy between any two voxels inside an organ had a non-linear inverse relationship with their Gaussian distance to solve the over-smoothed tumor morphology in BLT reconstruction. We compared the GWLP with conventional Tikhonov and Laplace regularization methods through various numerical simulations and in vivo orthotopic glioma mouse model experiments. The in vivo magnetic resonance imaging and ex vivo green fluorescent protein images and hematoxylin-eosin stained images of whole head cryoslicing specimens were utilized as gold standards. The results demonstrated that GWLP achieved the highest accuracy in tumor localization and tumor morphology preservation. To the best of our knowledge, this is the first study that achieved such accurate BLT morphological reconstruction of orthotopic glioma without using any segmented tumor structure from any other structural imaging modalities as the prior for reconstruction guidance. This enabled BLT more suitable and practical for in vivo imaging of orthotopic glioma mouse models.","1558-254X","","10.1109/TMI.2017.2737661","National Basic Research Program of China (973 Program)(grant numbers:2015CB755500); National Natural Science Foundation of China(grant numbers:81227901,61671449,81527805,61231004,61401462); CAS Youth Innovation Promotion Association(grant numbers:Y6S7021X51); ","https://ieeexplore.ieee.org/stamp/stamp.jsp?arnumber=8006243","Bioluminescence tomography;multi-modality fusion;brain","Image reconstruction;In vivo;Gaussian processes;Tomography;Tumors;Biomedical imaging;Bioluminescence","biological organs;bioluminescence;biomedical MRI;biomedical optical imaging;cancer;fluorescence;Gaussian processes;image reconstruction;image segmentation;Laplace equations;light scattering;medical image processing;molecular biophysics;optical tomography;proteins;tumours","bioluminescence tomography;Gaussian weighted Laplace prior regularization;in vivo morphological imaging;noninvasive molecular imaging tool;light scattering;ill-posed problems;reconstruction method;tumor morphology;bioluminescence energy;organ;nonlinear inverse relationship;Gaussian distance;over-smoothed tumor morphology;BLT reconstruction;conventional Tikhonov method;numerical simulations;in vivo orthotopic glioma mouse model experiments;in vivo magnetic resonance imaging;ex vivo green fluorescent protein images;hematoxylin-eosin stained images;whole head cryoslicing specimens;tumor localization;tumor morphology preservation;segmented tumor structure;structural imaging modalities;reconstruction guidance;orthotopic glioma mouse models","Animals;Female;Glioma;Imaging, Three-Dimensional;Luminescent Measurements;Mice;Mice, Inbred BALB C;Mice, Nude;Neoplasms, Experimental;Normal Distribution;Tomography, Optical","33","","51","IEEE","9 Aug 2017","","","IEEE","IEEE Journals"
"A canonical visualization tool for SEEG electrodes","H. Huang; G. O. Valencia; D. Hermes; K. J. Miller","Medical Scientist Training Program; Physiology and Biomedical Engineering Department; Physiology and Biomedical Engineering Department; Neurologic Surgery Department, Mayo Clinic, Rochester, MN, USA","2021 43rd Annual International Conference of the IEEE Engineering in Medicine & Biology Society (EMBC)","9 Dec 2021","2021","","","6175","6178","Stereoencephalographic (SEEG) electrodes are clinically implanted into the brains of patients with refractory epilepsy to locate foci of seizure onset. They are increasingly used in neurophysiology research to determine focal human brain activity in response to tasks or stimuli. Clear visualization of SEEG electrode location with respect to patient anatomy on magnetic resonance image (MRI) scan is vital to neuroscientific understanding. An intuitive way to accomplish this is to plot brain activity and labels at electrode locations on closest MRI slices along the canonical axial, coronal, and sagittal planes. Therefore, we’ve developed an open-source software tool in Matlab for visualizing SEEG electrode positions, determined from computed tomography (CT), onto canonical planes of resliced brain MRI. The code and graphical user interface are available at: https://github.com/MultimodalNeuroimagingLab/mnl_seegviewClinical Relevance— This tool enables precise communication of SEEG electrode activity and location by visualization on slices of MRI in canonical axial, coronal, and sagittal planes.","2694-0604","978-1-7281-1179-7","10.1109/EMBC46164.2021.9630724","","https://ieeexplore.ieee.org/stamp/stamp.jsp?arnumber=9630724","","Electrodes;Visualization;Magnetic resonance imaging;Computed tomography;Tools;Task analysis;Software tools","biomedical electrodes;biomedical MRI;computerised tomography;electroencephalography;medical disorders;medical image processing;neurophysiology","SEEG electrode location;patient anatomy;magnetic resonance image scan;open-source software tool;resliced brain MRI;canonical visualization tool;stereoencephalographic electrodes;refractory epilepsy;seizure onset;focal human brain activity;Matlab;computed tomography;SEEG electrode activity","Brain;Brain Mapping;Electrodes, Implanted;Electroencephalography;Humans;Magnetic Resonance Imaging","","","11","IEEE","9 Dec 2021","","","IEEE","IEEE Conferences"
