"Neurofeedback Control in Parkinsonian Patients Using Electrocorticography Signals Accessed Wirelessly With a Chronic, Fully Implanted Device","P. Khanna; N. C. Swann; C. de Hemptinne; S. Miocinovic; A. Miller; P. A. Starr; J. M. Carmena","The UC Berkeley-UCSF Graduate Program in Bioengineering, Berkeley, CA, USA; Department of Neurological Surgery, University of California, San Francisco, CA, USA; Department of Neurological Surgery, University of California, San Francisco, CA, USA; Department of Neurology, University of California, San Francisco, CA, USA; Department of Neurological Surgery, University of California, San Francisco, CA, USA; Department of Neurological Surgery, University of California, San Francisco, CA, USA; Department of Electrical Engineering and Computer Sciences, University of California–Berkeley and the Helen Wills Neuroscience Institute, Berkeley, CA, USA","IEEE Transactions on Neural Systems and Rehabilitation Engineering","24 Oct 2017","2017","25","10","1715","1724","Parkinson's disease (PD) is characterized by motor symptoms such as rigidity and bradykinesia that prevent normal movement. Beta band oscillations (13-30 Hz) in neural local field potentials (LFPs) have been associated with these motor symptoms. Here, three PD patients implanted with a therapeutic deep brain neural stimulator that can also record and wirelessly stream neural data played a neurofeedback game where they modulated their beta band power from sensorimotor cortical areas. Patients' beta band power was streamed in real-time to update the position of a cursor that they tried to drive into a cued target. After playing the game for 1-2 hours each, all three patients exhibited above chance-level performance regardless of subcortical stimulation levels. This study, for the first time, demonstrates using an invasive neural recording system for at-home neurofeedback training. Future work will investigate chronic neurofeedback training as a potentially therapeutic tool for patients with neurological disorders.","1558-0210","","10.1109/TNSRE.2016.2597243","National Science Foundation Graduate Research Fellowship; Defense Advanced Research Projects Agency(grant numbers:W911NF-14-2-0043); ","https://ieeexplore.ieee.org/stamp/stamp.jsp?arnumber=7549053","Brain–computer interfaces;neurofeedback;Parkinson’s disease","Neurofeedback;Training;Time-domain analysis;Real-time systems;Medical treatment;Lead;Channel estimation","bioelectric potentials;diseases;feedback;patient care;prosthetics","neurofeedback control;parkinsonian patients;electrocorticography signals;fully implanted device;Parkinson's disease;motor symptoms;rigidity;bradykinesia;beta band oscillations;local field potentials;therapeutic deep brain neural stimulator;sensorimotor cortical areas;invasive neural recording system;at-home neurofeedback training;neurological disorders;time 1 hour to 2 hour","Algorithms;Beta Rhythm;Brain-Computer Interfaces;Electrocorticography;Electrodes, Implanted;Equipment Design;Games, Experimental;Humans;Learning;Male;Middle Aged;Neurofeedback;Parkinsonian Disorders;Sensorimotor Cortex;Wireless Technology","25","","43","IEEE","24 Aug 2016","","","IEEE","IEEE Journals"
"Classification of high frequency oscillations in epileptic intracerebral EEG","N. Jrad; A. Kachenoura; I. Merlet; A. Nica; C. G. Bénar; F. Wendling","Laboratoire de Traitement du Signal et de L'image (LTSI), Université de Rennes 1, France; Wendling are with the Laboratoire de Traitement du Signal et de L'image (LTSI), Université de Rennes 1, France; Wendling are with the Laboratoire de Traitement du Signal et de L'image (LTSI), Université de Rennes 1, France; Wendling are with the Laboratoire de Traitement du Signal et de L'image (LTSI), Université de Rennes 1, France; Neurology department, CHU, Rennes, France; Faculté de Médecine, U751, Université de la Méditerranée Aix-Marseille II, Marseille, France","2015 37th Annual International Conference of the IEEE Engineering in Medicine and Biology Society (EMBC)","5 Nov 2015","2015","","","574","577","High Frequency Oscillations (HFOs 40-500 Hz), recorded from intracerebral electroencephalography (iEEG) in epileptic patients, are categorized into four distinct sub-bands (Gamma, High-Gamma, Ripples and Fast Ripples). They have recently been used as a reliable biomarker of epileptogenic zones. The objective of this paper is to investigate the possibility of discriminating between the different classes of HFOs which physiological/pathological value is critical for diagnostic but remains to be clarified. The proposed method is based on the definition of a relevant feature vector built from energy ratios (computed using Wavelet Transform-WT) in a-priori-defined frequency bands. It makes use of a multiclass Linear Discriminant Analysis (LDA) and is applied to iEEG signals recorded in patients candidate to epilepsy surgery. Results obtained from bootstrap on training/test datasets indicate high performances in terms of sensitivity and specificity.","1558-4615","978-1-4244-9271-8","10.1109/EMBC.2015.7318427","","https://ieeexplore.ieee.org/stamp/stamp.jsp?arnumber=7318427","","Hafnium compounds;Oscillators;Detectors;Time-frequency analysis;Sensitivity;Epilepsy;Sensitivity and specificity","bioelectric potentials;electroencephalography;medical disorders;medical signal processing;neurophysiology;signal classification;surgery;wavelet transforms","training-test datasets;epilepsy surgery;iEEG signal recording;multiclass linear discriminant analysis;wavelet transform;feature vector;physiological value;pathological value;epileptogenic zones;reliable biomarker;epileptic patients;intracerebral electroencephalography;epileptic intracerebral EEG;high frequency oscillations;classification","Brain;Electroencephalography;Epilepsy;Humans;Sensitivity and Specificity;Wavelet Analysis","6","","12","IEEE","5 Nov 2015","","","IEEE","IEEE Conferences"
"On comparing in vivo intracranial recordings in non-human primates to predictions of optimized transcranial electrical stimulation","A. Datta; M. R. Krause; P. K. Pilly; J. Choe; T. P. Zanos; C. Thomas; C. C. Pack","Research and Development, Soterix Medical, Inc., New York, NY, USA; Montreal Neurological Institute, McGill University, Montreal, QC, Canada; Information and Systems Sciences Laboratory, LLC, Malibu, CA, USA; Information and Systems Sciences Laboratory, LLC, Malibu, CA, USA; Montreal Neurological Institute, McGill University, Montreal, QC, Canada; Research and Development, Soterix Medical, Inc., New York, NY, USA; Montreal Neurological Institute, McGill University, Montreal, QC, Canada","2016 38th Annual International Conference of the IEEE Engineering in Medicine and Biology Society (EMBC)","18 Oct 2016","2016","","","1774","1777","Transcranial electrical stimulation (tES) can be optimized to achieve maximal current flow at desired brain regions. The aim of this study was to characterize electric field magnitudes generated by tES optimization and to compare them to experimentally induced values as determined by data from intracranial electrodes. Local field potentials were recorded from two monkeys with implanted multi-site intracranial Utah arrays during transcranial direct current stimulation (tDCS), and the neural effect predictions obtained from optimized electrode placement were assessed. Comparative data between the two sites of intracranial recordings during tDCS partially validated the predictions of our tES optimization algorithms.","1558-4615","978-1-4577-0220-4","10.1109/EMBC.2016.7591061","","https://ieeexplore.ieee.org/stamp/stamp.jsp?arnumber=7591061","","Electrodes;Animals;Optimization;Implants;Computational modeling;Predictive models;Surgery","bioelectric phenomena;biomedical electrodes;brain;patient treatment","in vivo intracranial recordings;nonhuman primates;transcranial electrical stimulation optimization;transcranial direct current stimulation;optimized electrode placement","Animals;Brain;Electric Stimulation;Electrodes;Primates;Transcranial Direct Current Stimulation;Utah","12","","13","IEEE","18 Oct 2016","","","IEEE","IEEE Conferences"
"Demonstration of an Optimized Large-scale Optogenetic Cortical Interface for Non-human Primates","D. J. Griggs; J. Bloch; S. Fisher; W. K. S. Ojemann; K. M. Coubrough; K. Khateeb; M. Chu; A. Yazdan-Shahmorad","University of Washington, Seattle, WA, USA; University of Washington, Seattle, WA, USA; University of Washington, Seattle, WA, USA; University of Pennsylvania; Spanish Ministry of Education; University of Washington, Seattle, WA, USA; University of Washington, Seattle, WA, USA; University of Washington, Seattle, WA, USA","2022 44th Annual International Conference of the IEEE Engineering in Medicine & Biology Society (EMBC)","8 Sep 2022","2022","","","3081","3084","Optogenetics is a powerful neuroscientific tool which allows neurons to be modulated by optical stimulation. Despite widespread optogenetic experimentation in small animal models, optogenetics in non-human primates (NHPs) remains a niche field, particularly at the large scales necessary for multi-regional neural research. We previously published a large-scale, chronic optogenetic cortical interface for NHPs which was successful but came with a number of limitations. In this work, we present an optimized interface which improves upon the stability and scale of our previous interface while using more easily replicable methods to increase our system's availability to the scientific community. Specifically, we (1) demonstrate the long-term (~3 months) optical access to the brain achievable using a commercially-available transparent artificial dura with embedded electrodes, (2) showcase large-scale optogenetic expression achievable with simplified (magnetic resonance-free) surgical techniques, and (3) effectively modulated the expressing areas at large scales (~1 cm2) by light emitting diode (LED) arrays assembled in-house.","2694-0604","978-1-7281-2782-8","10.1109/EMBC48229.2022.9871332","","https://ieeexplore.ieee.org/stamp/stamp.jsp?arnumber=9871332","","Training;Neuroscience;Stimulated emission;Animals;Scholarships;Surgery;Light emitting diodes","bioelectric potentials;biomedical electrodes;bio-optics;brain;neurophysiology;prosthetics","large-scale optogenetic cortical interface;nonhuman primates;optical stimulation;animal models;multiregional neural research;chronic optogenetic cortical interface;optical access;large-scale optogenetic expression;transparent artificial dura;embedded electrodes;light emitting diode arrays;LED arrays;time 3.0 month","Animals;Brain;Neurons;Optogenetics;Photic Stimulation;Primates","1","","23","IEEE","8 Sep 2022","","","IEEE","IEEE Conferences"
"Spatial and temporal analysis of interictal activity in the epileptic brain","P. McCall; M. Cabrerizo; M. Adjouadi","Department of ECE, Florida International University, Miami, FL, USA; Department of ECE, Florida International University, Miami, FL, USA; Department of ECE, Florida International University, Miami, FL, USA","2012 IEEE Signal Processing in Medicine and Biology Symposium (SPMB)","25 Feb 2013","2012","","","1","6","In clinical and research settings numerous algorithms have been developed for the analysis of electroencephalographic (EEG) data in the diagnosis of epilepsy and throughout the process of localizing the seizure onset zone (SOZ). This research highlights the merging of two major detection algorithms for the identification of High-Frequency Oscillations (HFO), also known as ripples, and Interictal Spikes (IIS) in both the spatial and temporal domain. IIS and HFO have become recognized as reliable biomarkers in identification of the epileptic focus in the cortex of epileptic patients. While IIS, commonly referred to as spikes, have classically been used for the diagnosis of epilepsy and for source localization techniques, ripples have been associated with more generalized cortex regions of interest and surrogate biomarkers for the seizure onset zone (SOZ). This research aims to combine these two analyses by correlating HFO and IIS events in the time domain for each electrode recording with the goal of yielding a more complete understanding of the abnormal electrical activity of the cortex in epileptic patients. Results are offered in the form HFO and IIS events per electrode as well as a surface representation of the number of temporally superimposed HFO and IIS per electrode.","","978-1-4673-5666-4","10.1109/SPMB.2012.6469459","","https://ieeexplore.ieee.org/stamp/stamp.jsp?arnumber=6469459","EEG processing;High frequency oscillation;Interictal spike","Electrodes;Hafnium oxide;Epilepsy;Electroencephalography;Surgery;Detection algorithms","bioelectric phenomena;biomedical electrodes;electroencephalography;medical disorders;medical signal detection;medical signal processing;neurophysiology;oscillations;spatiotemporal phenomena;time-domain analysis","temporal analysis;spatial analysis;interictal activity;epileptic brain;research settings;clinical settings;electroencephalographic data;EEG;epilepsy diagnosis;seizure onset zone;high-frequency oscillation identification;interictal spikes;spatial domain;temporal domain;epileptic focus;epileptic patients;source localization techniques;generalized cortex regions;surrogate biomarkers;time domain;electrode recording;abnormal electrical activity;detection algorithms;ripples","","","","9","IEEE","25 Feb 2013","","","IEEE","IEEE Conferences"
"Feasibility of a chronic, minimally invasive endovascular neural interface","N. L. Opie; G. S. Rind; S. E. John; S. M. Ronayne; D. B. Grayden; A. N. Burkitt; C. N. May; T. J. O'Brien; T. J. Oxley","Florey Institute of Neuroscience and Mental Health; The Department of Medicine, The University of Melbourne; The Department of Electrical and Electronic Engineering, The University of Melbourne; The Department of Medicine, The University of Melbourne; The Department of Electrical and Electronic Engineering, The University of Melbourne; The Department of Electrical and Electronic Engineering, The University of Melbourne; Florey Institute of Neuroscience and Mental Health; The Department of Medicine, The University of Melbourne; The Department of Medicine, The University of Melbourne","2016 38th Annual International Conference of the IEEE Engineering in Medicine and Biology Society (EMBC)","18 Oct 2016","2016","","","4455","4458","Development of a neural interface that can be implanted without risky, open brain surgery will increase the safety and viability of chronic neural recording arrays. We have developed a minimally invasive surgical procedure and an endovascular electrode-array that can be delivered to overlie the cortex through blood vessels. Here, we describe feasibility of the endovascular interface through electrode viability, recording potential and safety. Electrochemical impedance spectroscopy demonstrated that electrode impedance was stable over 91 days and low frequency phase could be used to infer electrode incorporation into the vessel wall. Baseline neural recording were used to identify the maximum bandwidth of the neural interface, which remained stable around 193 Hz for six months. Cross-sectional areas of the implanted vessels were non-destructively measured using the Australian Synchrotron. There was no case of occlusion observed in any of the implanted animals. This work demonstrates the feasibility of an endovascular neural interface to safely and efficaciously record neural information over a chronic time course.","1558-4615","978-1-4577-0220-4","10.1109/EMBC.2016.7591716","","https://ieeexplore.ieee.org/stamp/stamp.jsp?arnumber=7591716","","Animals;Electrodes;Bandwidth;Impedance;Safety;Electrochemical impedance spectroscopy;Biomedical imaging","biomedical electronics;blood vessels;brain;computerised tomography;electrochemical impedance spectroscopy;neurophysiology","chronic minimally invasive endovascular neural interface;chronic neural recording arrays;minimally invasive surgical procedure;endovascular electrode-array;cortex;blood vessels;endovascular interface;electrode viability;potential recording;safety recording;electrochemical impedance spectroscopy;electrode impedance;frequency phase;electrode incorporation;vessel wall;baseline neural recording;maximum bandwidth;cross-sectional areas;Australian synchrotron;implanted animals;chronic time course;time 91 d;time 6 month","Animals;Brain-Computer Interfaces;Cerebral Cortex;Dielectric Spectroscopy;Electrodes, Implanted;Endovascular Procedures;Sheep;Stents","9","","20","IEEE","18 Oct 2016","","","IEEE","IEEE Conferences"
"Real-time predictive analytics in postoperative critical care","A. Meyer","Department of Cardiothoracic and Vascular Surgery, BIFOLD, German Heart Center Berlin; TU Berlin, Berlin, Germany","2020 8th International Winter Conference on Brain-Computer Interface (BCI)","9 Apr 2020","2020","","","1","1","Predictive analytics in healthcare is not a new endeavor. Since ages physicians are thriving to develop calculated markers that enable them to react promptly and precisely on patient's deterioration before irreversible damage has occurred. The advent of deep learning has opened new possibilities and started excitement in this field. This talk will discuss recent findings, possibilities and challenges of predictive analytics in the data intense environment of critical care.","2572-7672","978-1-7281-4707-9","10.1109/BCI48061.2020.9061610","","https://ieeexplore.ieee.org/stamp/stamp.jsp?arnumber=9061610","Machine learning;deep learning;healthcare;ciritical care","Machine learning;Real-time systems;Robustness;Surgery;Heart;Fingerprint recognition","data analysis;health care;learning (artificial intelligence);neural nets;real-time systems","postoperative critical care;healthcare;patient;irreversible damage;deep learning;real time predictive analytics","","","","2","IEEE","9 Apr 2020","","","IEEE","IEEE Conferences"
"Complexity and Nonlinearities of Short-Term Cardiovascular and Cerebrovascular Controls after Surgical Aortic Valve Replacement","A. Porta; A. Fantinato; V. Bari; B. Cairo; B. De Maria; E. G. Bertoldo; V. Fiolo; E. Callus; C. De Vincentiis; M. Volpe; R. Molfetta; M. Ranucci","Department of Biomedical Sciences for Health, University of Milan, Milan, Italy; Department of Cardiothoracic, Vascular Anesthesia and Intensive Care, IRCCS Policlinico San Donato, Milan, Italy; Department of Cardiothoracic, Vascular Anesthesia and Intensive Care, IRCCS Policlinico San Donato, Milan, Italy; Department of Biomedical Sciences for Health, University of Milan, Milan, Italy; IRCCS Istituti Clinici Scientifici Maugeri, Milan, Italy; Clinical Psychology Service, IRCCS Policlinico San Donato, Milan, Italy; Clinical Psychology Service, IRCCS Policlinico San Donato, Milan, Italy; Clinical Psychology Service, IRCCS Policlinico San Donato, Milan, Italy; Department of Cardiac Surgery, IRCCS Policlinico San Donato, Milan, Italy; Department of Cardiac Rehabilitation, IRCCS Policlinico San Donato, Milan, Italy; Department of Cardiac Rehabilitation, IRCCS Policlinico San Donato, Milan, Italy; Department of Cardiothoracic, Vascular Anesthesia and Intensive Care, IRCCS Policlinico San Donato, Milan, Italy","2020 42nd Annual International Conference of the IEEE Engineering in Medicine & Biology Society (EMBC)","27 Aug 2020","2020","","","2569","2572","We assessed the effect of surgical aortic valve replacement (SAVR) on cardiovascular and cerebrovascular controls with particular attention to their complexity and presence of nonlinear behaviors via the analysis of spontaneous variability of heart period (HP), systolic and diastolic arterial pressure (SAP and DAP) and mean cerebral blood flow (MCBF). Variability series were acquired before (PRE) and after (POST) SAVR in 12 patients (age: 76±4.7 yrs, 7 males) at rest in supine position and during active standing. Complexity was assessed via a local nonlinear prediction approach exploiting the k-nearest neighbor strategy. The presence of nonlinear dynamics was checked by comparing the complexity marker computed over the original series with the distribution of values assessed over 100 surrogates preserving distribution and power spectral density of the original series but with random phases. We found that: i) HP variance was significantly reduced in POST; ii) the complexity of SAP and DAP variabilities increased in POST with a greater likelihood of observing nonlinear dynamics over SAP compared to PRE at supine rest; iii) the amplitude of MCBF fluctuations and its complexity in POST remained similar to PRE. SAVR induces important changes of the cardiac and vascular autonomic controls, while cerebrovascular regulation seems to be less affected.","2694-0604","978-1-7281-1990-8","10.1109/EMBC44109.2020.9175321","","https://ieeexplore.ieee.org/stamp/stamp.jsp?arnumber=9175321","","Complexity theory;Nonlinear dynamical systems;Surgery;Bars;Electronic mail;Blood pressure;Valves","biomechanics;blood pressure measurement;blood vessels;brain;cardiovascular system;diseases;haemodynamics;medical signal processing;neurophysiology","cerebrovascular regulation;vascular autonomic controls;supine rest;DAP variabilities;SAP;power spectral density;original series;complexity marker;nonlinear dynamics;k-nearest neighbor strategy;local nonlinear prediction approach;variability series;diastolic arterial pressure;spontaneous variability;nonlinear behaviors;cerebrovascular controls;cardiovascular controls;surgical aortic valve replacement","Aged;Aged, 80 and over;Aortic Valve;Autonomic Nervous System;Blood Pressure;Cardiovascular System;Heart Rate;Humans;Male","1","","24","IEEE","27 Aug 2020","","","IEEE","IEEE Conferences"
