PMID,Title,Authors,Citation,First Author,Journal/Book,Publication Year,Create Date,PMCID,NIHMS ID,DOI
"18293577","Visualizing localized dynamic changes during epileptic seizure onset in vivo with diffuse optical tomography","Wang Q, Liang X, Liu Z, Zhang Q, Carney P, Jiang H.","Med Phys. 2008 Jan;35(1):216-24. doi: 10.1118/1.2818736.","Wang Q","Med Phys","2008","2008/02/26","","","10.1118/1.2818736"
"22352659","Motion clustering for deblurring multispectral optoacoustic tomography images of the mouse heart","Taruttis A, Claussen J, Razansky D, Ntziachristos V.","J Biomed Opt. 2012 Jan;17(1):016009. doi: 10.1117/1.JBO.17.1.016009.","Taruttis A","J Biomed Opt","2012","2012/02/23","","","10.1117/1.JBO.17.1.016009"
"22808425","Multispectral scanning time-resolved fluorescence spectroscopy (TRFS) technique for intravascular diagnosis","Xie H, Bec J, Liu J, Sun Y, Lam M, Yankelevich DR, Marcu L.","Biomed Opt Express. 2012 Jul 1;3(7):1521-33. doi: 10.1364/BOE.3.001521. Epub 2012 Jun 6.","Xie H","Biomed Opt Express","2012","2012/07/19","PMC3395478","","10.1364/BOE.3.001521"
"16878566","Multispectral breast imaging using a ten-wavelength, 64 x 64 source/detector channels silicon photodiode-based diffuse optical tomography system","Li C, Zhao H, Anderson B, Jiang H.","Med Phys. 2006 Mar;33(3):627-36. doi: 10.1118/1.2171508.","Li C","Med Phys","2006","2006/08/02","","","10.1118/1.2171508"
"25548990","Geometrically undistorted MRI in the presence of field inhomogeneities using compressed sensing accelerated broadband 3D phase encoded turbo spin-echo imaging","van Gorp JS, Bakker CJ, Bouwman JG, Smink J, Zijlstra F, Seevinck PR.","Phys Med Biol. 2015 Jan 21;60(2):615-31. doi: 10.1088/0031-9155/60/2/615. Epub 2014 Dec 30.","van Gorp JS","Phys Med Biol","2015","2014/12/31","","","10.1088/0031-9155/60/2/615"
"18982609","Optimal feature selection applied to multispectral fluorescence imaging","Wood TC, Thiemjarus S, Koh KR, Elson DS, Yang GZ.","Med Image Comput Comput Assist Interv. 2008;11(Pt 2):222-9. doi: 10.1007/978-3-540-85990-1_27.","Wood TC","Med Image Comput Comput Assist Interv","2008","2008/11/06","","","10.1007/978-3-540-85990-1_27"
"19964154","Bioluminescence tomography with CT/MRI co-registration","Klose AD, Beattie BJ.","Annu Int Conf IEEE Eng Med Biol Soc. 2009;2009:6327-30. doi: 10.1109/IEMBS.2009.5333170.","Klose AD","Annu Int Conf IEEE Eng Med Biol Soc","2009","2009/12/08","","","10.1109/IEMBS.2009.5333170"
"18059661","Multispectral diffuse optical tomography with absorption and scattering spectral constraints","Li C, Grobmyer SR, Chen L, Zhang Q, Fajardo LL, Jiang H.","Appl Opt. 2007 Dec 1;46(34):8229-36. doi: 10.1364/ao.46.008229.","Li C","Appl Opt","2007","2007/12/07","","","10.1364/ao.46.008229"
"21559118","Quantitative principal component model for skin chromophore mapping using multi-spectral images and spatial priors","Kainerstorfer JM, Riley JD, Ehler M, Najafizadeh L, Amyot F, Hassan M, Pursley R, Demos SG, Chernomordik V, Pircher M, Smith PD, Hitzenberger CK, Gandjbakhche AH.","Biomed Opt Express. 2011 Apr 1;2(5):1040-58. doi: 10.1364/BOE.2.001040.","Kainerstorfer JM","Biomed Opt Express","2011","2011/05/12","PMC3087563","","10.1364/BOE.2.001040"
"23366083","A new method to estimate abundances of multiple components using multi-spectral fluorescence lifetime imaging microscopy","Gutierrez-Navarro O, Arce-Santana ER, Campos-Delgado DU, Mendez MO, Jo JA.","Annu Int Conf IEEE Eng Med Biol Soc. 2012;2012:1081-4. doi: 10.1109/EMBC.2012.6346122.","Gutierrez-Navarro O","Annu Int Conf IEEE Eng Med Biol Soc","2012","2013/02/01","","","10.1109/EMBC.2012.6346122"
"35309993","Evaluation of Tracheal Stenosis in Rabbits Using Multispectral Optoacoustic Tomography","Wen Y, Wu D, Zhang J, Jiang S, Xiong C, Guo D, Chi Z, Chen Y, Li L, Yang Y, Liu T, Jiang H.","Front Bioeng Biotechnol. 2022 Mar 4;10:860305. doi: 10.3389/fbioe.2022.860305. eCollection 2022.","Wen Y","Front Bioeng Biotechnol","2022","2022/03/21","PMC8931196","","10.3389/fbioe.2022.860305"
"25245691","Active cell and ECM movements during development","Aleksandrova A, Rongish BJ, Little CD, Czirók A.","Methods Mol Biol. 2015;1189:123-32. doi: 10.1007/978-1-4939-1164-6_9.","Aleksandrova A","Methods Mol Biol","2015","2014/09/24","PMC4401075","NIHMS658056","10.1007/978-1-4939-1164-6_9"
"23625491","Multispectral imaging and automated laser capture microdissection of human cortical neurons: a quantitative study of CXCR4 expression","Pitcher J, Wurth R, Shimizu S, Meucci O.","Methods Mol Biol. 2013;1013:31-48. doi: 10.1007/978-1-62703-426-5_3.","Pitcher J","Methods Mol Biol","2013","2013/04/30","PMC4011070","NIHMS570475","10.1007/978-1-62703-426-5_3"
"30178368","A Fibreless Multiwavelength NIRS System for Imaging Localised Changes in Cerebral Oxidised Cytochrome C Oxidase","Highton D, Chitnis D, Brigadoi S, Phan P, Tachtsidis I, Cooper R, Everdell N, Hebden J, Smith M, Elwell CE.","Adv Exp Med Biol. 2018;1072:339-343. doi: 10.1007/978-3-319-91287-5_54.","Highton D","Adv Exp Med Biol","2018","2018/09/05","PMC9761529","","10.1007/978-3-319-91287-5_54"
"16178638","Hyperspectral imaging of hemoglobin saturation in tumor microvasculature and tumor hypoxia development","Sorg BS, Moeller BJ, Donovan O, Cao Y, Dewhirst MW.","J Biomed Opt. 2005 Jul-Aug;10(4):44004. doi: 10.1117/1.2003369.","Sorg BS","J Biomed Opt","2005","2005/09/24","","","10.1117/1.2003369"
"30460364","Hyperspectral analysis applied to micro-Brillouin maps of amyloid-beta plaques in Alzheimer's disease brains","Palombo F , Masia F , Mattana S , Tamagnini F , Borri P , Langbein W , Fioretto D .","Analyst. 2018 Dec 3;143(24):6095-6102. doi: 10.1039/c8an01291a.","Palombo F","Analyst","2018","2018/11/22","PMC6336087","","10.1039/c8an01291a"
"32526699","Non-invasive real-time imaging of reactive oxygen species (ROS) using auto-fluorescence multispectral imaging technique: A novel tool for redox biology","Habibalahi A, Moghari MD, Campbell JM, Anwer AG, Mahbub SB, Gosnell M, Saad S, Pollock C, Goldys EM.","Redox Biol. 2020 Jul;34:101561. doi: 10.1016/j.redox.2020.101561. Epub 2020 May 12.","Habibalahi A","Redox Biol","2020","2020/06/12","PMC7287272","","10.1016/j.redox.2020.101561"
"34409430","Insights into in vivo adipocyte differentiation through cell-specific labeling in zebrafish","Lepanto P, Levin-Ferreyra F, Koziol U, Malacrida L, Badano JL.","Biol Open. 2021 Sep 15;10(9):bio058734. doi: 10.1242/bio.058734. Epub 2021 Sep 9.","Lepanto P","Biol Open","2021","2021/08/19","PMC8443861","","10.1242/bio.058734"
"31417847","Unmixing multi-spectral photoacoustic sources in human carotid plaques using non-negative independent component analysis","Arabul MU, Rutten MCM, Bruneval P, van Sambeek MRHM, van de Vosse FN, Lopata RGP.","Photoacoustics. 2019 Jul 25;15:100140. doi: 10.1016/j.pacs.2019.100140. eCollection 2019 Sep.","Arabul MU","Photoacoustics","2019","2019/08/17","PMC6690666","","10.1016/j.pacs.2019.100140"
"32489227","Cancer Detection Using Hyperspectral Imaging and Evaluation of the Superficial Tumor Margin Variance with Depth","Halicek M, Fabelo H, Ortega S, Little JV, Wang X, Chen AY, Callico GM, Myers LL, Sumer BD, Fei B.","Proc SPIE Int Soc Opt Eng. 2019 Feb;10951:109511A. doi: 10.1117/12.2512985. Epub 2019 Mar 8.","Halicek M","Proc SPIE Int Soc Opt Eng","2019","2020/06/04","PMC7265739","NIHMS1592293","10.1117/12.2512985"
"35154874","Optical oxygen saturation imaging in cellular ex vivo lung perfusion to assess lobular pulmonary function","Sakota D, Kosaka R, Niikawa H, Ohuchi K, Arai H, McCurry KR, Okamoto T.","Biomed Opt Express. 2021 Dec 14;13(1):328-343. doi: 10.1364/BOE.445021. eCollection 2022 Jan 1.","Sakota D","Biomed Opt Express","2021","2022/02/14","PMC8803022","","10.1364/BOE.445021"
"34522607","Detection of collagen by multi-wavelength photoacoustic analysis as a biomarker for bone health assessment","Feng T, Ge Y, Xie Y, Xie W, Liu C, Li L, Ta D, Jiang Q, Cheng Q.","Photoacoustics. 2021 Aug 26;24:100296. doi: 10.1016/j.pacs.2021.100296. eCollection 2021 Dec.","Feng T","Photoacoustics","2021","2021/09/15","PMC8426564","","10.1016/j.pacs.2021.100296"
"31762531","Applications and assessment of an excitation-scanning hyperspectral imaging system","Mayes SA, Moore K, Browning C, Klomkaew P, Rich TC, Leavesley SJ.","Proc SPIE Int Soc Opt Eng. 2018 Jan-Feb;10497:1049706. doi: 10.1117/12.2290120. Epub 2018 Feb 20.","Mayes SA","Proc SPIE Int Soc Opt Eng","2018","2019/11/26","PMC6874376","NIHMS1019157","10.1117/12.2290120"
"32374764","Long-term in vivo biocompatibility of single-walled carbon nanotubes","Galassi TV, Antman-Passig M, Yaari Z, Jessurun J, Schwartz RE, Heller DA.","PLoS One. 2020 May 6;15(5):e0226791. doi: 10.1371/journal.pone.0226791. eCollection 2020.","Galassi TV","PLoS One","2020","2020/05/07","PMC7202660","","10.1371/journal.pone.0226791"
"35541024","Multispectral optoacoustic tomography for in vivo detection of lymph node metastases in oral cancer patients using an EGFR-targeted contrast agent and intrinsic tissue contrast: A proof-of-concept study","Vonk J, Kukačka J, Steinkamp PJ, de Wit JG, Voskuil FJ, Hooghiemstra WTR, Bader M, Jüstel D, Ntziachristos V, van Dam GM, Witjes MJH.","Photoacoustics. 2022 Apr 29;26:100362. doi: 10.1016/j.pacs.2022.100362. eCollection 2022 Jun.","Vonk J","Photoacoustics","2022","2022/05/11","PMC9079001","","10.1016/j.pacs.2022.100362"
"34229278","Multimodal imaging as optical biopsy system for gastritis diagnosis in humans, and input of the mouse model","Bazin T, Krebs A, Jobart-Malfait A, Camilo V, Michel V, Benezeth Y, Marzani F, Touati E, Lamarque D.","EBioMedicine. 2021 Jul;69:103462. doi: 10.1016/j.ebiom.2021.103462. Epub 2021 Jul 3.","Bazin T","EBioMedicine","2021","2021/07/06","PMC8264104","","10.1016/j.ebiom.2021.103462"
"27499123","Objective Detection of Oral Carcinoma with Multispectral Fluorescence Lifetime Imaging In Vivo","Malik BH, Lee J, Cheng S, Cuenca R, Jabbour JM, Cheng YS, Wright JM, Ahmed B, Maitland KC, Jo JA.","Photochem Photobiol. 2016 Sep;92(5):694-701. doi: 10.1111/php.12627. Epub 2016 Sep 7.","Malik BH","Photochem Photobiol","2016","2016/08/09","PMC5705081","NIHMS920716","10.1111/php.12627"
"26124201","Targeting Acidity in Pancreatic Adenocarcinoma: Multispectral Optoacoustic Tomography Detects pH-Low Insertion Peptide Probes In Vivo","Kimbrough CW, Khanal A, Zeiderman M, Khanal BR, Burton NC, McMasters KM, Vickers SM, Grizzle WE, McNally LR.","Clin Cancer Res. 2015 Oct 15;21(20):4576-85. doi: 10.1158/1078-0432.CCR-15-0314. Epub 2015 Jun 29.","Kimbrough CW","Clin Cancer Res","2015","2015/07/01","PMC4609270","NIHMS704151","10.1158/1078-0432.CCR-15-0314"
"22695584","Fast multispectral diffuse optical tomography system for in vivo three-dimensional imaging of seizure dynamics","Yang J, Zhang T, Yang H, Jiang H.","Appl Opt. 2012 Jun 1;51(16):3461-9. doi: 10.1364/AO.51.003461.","Yang J","Appl Opt","2012","2012/06/15","PMC3553592","NIHMS432448","10.1364/AO.51.003461"
"25826624","Thermosensitive, near-infrared-labeled nanoparticles for topotecan delivery to tumors","Rosca EV, Wright M, Gonitel R, Gedroyc W, Miller AD, Thanou M.","Mol Pharm. 2015 May 4;12(5):1335-46. doi: 10.1021/mp5002679. Epub 2015 Apr 20.","Rosca EV","Mol Pharm","2015","2015/04/01","","","10.1021/mp5002679"
"23041325","Multispectral endoscopic imaging of colorectal dysplasia in vivo","Joshi BP, Miller SJ, Lee CM, Seibel EJ, Wang TD.","Gastroenterology. 2012 Dec;143(6):1435-7. doi: 10.1053/j.gastro.2012.08.053. Epub 2012 Oct 3.","Joshi BP","Gastroenterology","2012","2012/10/09","PMC3547605","NIHMS417022","10.1053/j.gastro.2012.08.053"
"20634868","Video rate optoacoustic tomography of mouse kidney perfusion","Buehler A, Herzog E, Razansky D, Ntziachristos V.","Opt Lett. 2010 Jul 15;35(14):2475-7. doi: 10.1364/OL.35.002475.","Buehler A","Opt Lett","2010","2010/07/17","","","10.1364/OL.35.002475"
"27144537","Lymph Node Micrometastases and In-Transit Metastases from Melanoma: In Vivo Detection with Multispectral Optoacoustic Imaging in a Mouse Model","Neuschmelting V, Lockau H, Ntziachristos V, Grimm J, Kircher MF.","Radiology. 2016 Jul;280(1):137-50. doi: 10.1148/radiol.2016160191. Epub 2016 May 4.","Neuschmelting V","Radiology","2016","2016/05/05","PMC4942996","","10.1148/radiol.2016160191"
"33401758","Mutation of the Cell Cycle Regulator p27kip1 Drives Pseudohypoxic Pheochromocytoma Development","Mohr H, Ballke S, Bechmann N, Gulde S, Malekzadeh-Najafabadi J, Peitzsch M, Ntziachristos V, Steiger K, Wiedemann T, Pellegata NS.","Cancers (Basel). 2021 Jan 2;13(1):126. doi: 10.3390/cancers13010126.","Mohr H","Cancers (Basel)","2021","2021/01/06","PMC7794757","","10.3390/cancers13010126"
"35788444","High-resolution label-free mapping of murine kidney vasculature by raster-scanning optoacoustic mesoscopy: an ex vivo study","Goebel CA, Brown E, Fahlbusch FB, Wagner AL, Buehler A, Raupach T, Hohmann M, Späth M, Burton N, Woelfle J, Schmidt M, Hartner A, Regensburger AP, Knieling F.","Mol Cell Pediatr. 2022 Jul 4;9(1):13. doi: 10.1186/s40348-022-00144-0.","Goebel CA","Mol Cell Pediatr","2022","2022/07/05","PMC9253231","","10.1186/s40348-022-00144-0"
"26860296","Optical imaging of pre-invasive breast cancer with a combination of VHHs targeting CAIX and HER2 increases contrast and facilitates tumour characterization","Kijanka MM, van Brussel AS, van der Wall E, Mali WP, van Diest PJ, van Bergen En Henegouwen PM, Oliveira S.","EJNMMI Res. 2016 Dec;6(1):14. doi: 10.1186/s13550-016-0166-y. Epub 2016 Feb 10.","Kijanka MM","EJNMMI Res","2016","2016/02/11","PMC4747965","","10.1186/s13550-016-0166-y"
"4033583","Spectral transmittance and contrast in breast diaphanography","Ertefai S, Profio AE.","Med Phys. 1985 Jul-Aug;12(4):393-400. doi: 10.1118/1.595701.","Ertefai S","Med Phys","1985","1985/07/01","","","10.1118/1.595701"
"33037671","3D wide-field multispectral photoacoustic imaging of human melanomas in vivo: a pilot study","Park B, Bang CH, Lee C, Han JH, Choi W, Kim J, Park GS, Rhie JW, Lee JH, Kim C.","J Eur Acad Dermatol Venereol. 2021 Mar;35(3):669-676. doi: 10.1111/jdv.16985. Epub 2020 Dec 5.","Park B","J Eur Acad Dermatol Venereol","2021","2020/10/10","","","10.1111/jdv.16985"
"22876354","Multispectral nanoparticle contrast agents for true-color spectroscopic optical coherence tomography","Li YL, Seekell K, Yuan H, Robles FE, Wax A.","Biomed Opt Express. 2012 Aug 1;3(8):1914-23. doi: 10.1364/BOE.3.001914. Epub 2012 Jul 20.","Li YL","Biomed Opt Express","2012","2012/08/10","PMC3409709","","10.1364/BOE.3.001914"
"21572915","Non-invasive, Contrast-enhanced Spectral Imaging of Breast Cancer Signatures in Preclinical Animal Models In vivo","Ramanujan VK, Ren S, Park S, Farkas DL.","J Cell Sci Ther. 2010 Oct 2;1(102):1000102. doi: 10.4172/2157-7013.1000102.","Ramanujan VK","J Cell Sci Ther","2010","2011/05/17","PMC3093534","NIHMS247789","10.4172/2157-7013.1000102"
"36658278","HyU: Hybrid Unmixing for longitudinal in vivo imaging of low signal-to-noise fluorescence","Chiang HJ, Koo DES, Kitano M, Burkitt S, Unruh JR, Zavaleta C, Trinh LA, Fraser SE, Cutrale F.","Nat Methods. 2023 Feb;20(2):248-258. doi: 10.1038/s41592-022-01751-5. Epub 2023 Jan 19.","Chiang HJ","Nat Methods","2023","2023/01/19","PMC9911352","","10.1038/s41592-022-01751-5"
"28485130","Fluorescence hyperspectral imaging (fHSI) using a spectrally resolved detector array","Luthman AS, Dumitru S, Quiros-Gonzalez I, Joseph J, Bohndiek SE.","J Biophotonics. 2017 Jun;10(6-7):840-853. doi: 10.1002/jbio.201600304. Epub 2017 May 9.","Luthman AS","J Biophotonics","2017","2017/05/10","PMC5953275","","10.1002/jbio.201600304"
"31528662","Hyperspectral imaging for head and neck cancer detection: specular glare and variance of the tumor margin in surgical specimens","Halicek M, Fabelo H, Ortega S, Little JV, Wang X, Chen AY, Callico GM, Myers L, Sumer BD, Fei B.","J Med Imaging (Bellingham). 2019 Jul;6(3):035004. doi: 10.1117/1.JMI.6.3.035004. Epub 2019 Sep 14.","Halicek M","J Med Imaging (Bellingham)","2019","2019/09/19","PMC6744927","","10.1117/1.JMI.6.3.035004"
"27069872","Performance of a Multispectral Optoacoustic Tomography (MSOT) System equipped with 2D vs. 3D Handheld Probes for Potential Clinical Translation","Neuschmelting V, Burton NC, Lockau H, Urich A, Harmsen S, Ntziachristos V, Kircher MF.","Photoacoustics. 2015 Dec 25;4(1):1-10. doi: 10.1016/j.pacs.2015.12.001. eCollection 2016 Mar.","Neuschmelting V","Photoacoustics","2015","2016/04/13","PMC4811917","","10.1016/j.pacs.2015.12.001"
"31907497","The search for a unique Raman signature of amyloid-beta plaques in human brain tissue from Alzheimer's disease patients","Lochocki B, Morrema THJ, Ariese F, Hoozemans JJM, de Boer JF.","Analyst. 2020 Mar 2;145(5):1724-1736. doi: 10.1039/c9an02087j.","Lochocki B","Analyst","2020","2020/01/08","","","10.1039/c9an02087j"
"33440536","Real-Time Imaging Tracking of a Dual Fluorescent Drug Delivery System Based on Zinc Phthalocyanine-Incorporated Hydrogel","Dong X, Wei C, Chen H, Qin J, Liang J, Kong D, Liu T, Lv F.","ACS Biomater Sci Eng. 2016 Nov 14;2(11):2001-2010. doi: 10.1021/acsbiomaterials.6b00403. Epub 2016 Sep 15.","Dong X","ACS Biomater Sci Eng","2016","2021/01/14","","","10.1021/acsbiomaterials.6b00403"
"20445830","Image-guided near infrared spectroscopy using boundary element method: phantom validation","Srinivasan S, Carpenter C, Pogue BW, Paulsen KD.","Proc SPIE Int Soc Opt Eng. 2009 Feb 20;7171:717103. doi: 10.1117/12.808938.","Srinivasan S","Proc SPIE Int Soc Opt Eng","2009","2011/09/28","PMC2863336","NIHMS194402","10.1117/12.808938"
"27367111","Uniqueness in multispectral constant-wave epi-illumination imaging","Garcia-Allende PB, Radrich K, Symvoulidis P, Glatz J, Koch M, Jentoft KM, Ripoll J, Ntziachristos V.","Opt Lett. 2016 Jul 1;41(13):3098-101. doi: 10.1364/OL.41.003098.","Garcia-Allende PB","Opt Lett","2016","2016/07/02","","","10.1364/OL.41.003098"
"21258457","A dual-modality optical coherence tomography and fluorescence lifetime imaging microscopy system for simultaneous morphological and biochemical tissue characterization","Park J, Jo JA, Shrestha S, Pande P, Wan Q, Applegate BE.","Biomed Opt Express. 2010 Jul 16;1(1):186-200. doi: 10.1364/BOE.1.000186.","Park J","Biomed Opt Express","2010","2011/01/25","PMC3005181","","10.1364/BOE.1.000186"
"34661967","In vivo sensing of cutaneous edema: A comparative study of diffuse reflectance, Raman spectroscopy and multispectral imaging","Budylin GS, Davydov DA, Zlobina NV, Baev AV, Artyushenko VG, Yakimov BP, Shirshin EA.","J Biophotonics. 2022 Jan;15(1):e202100268. doi: 10.1002/jbio.202100268. Epub 2021 Oct 30.","Budylin GS","J Biophotonics","2022","2021/10/18","","","10.1002/jbio.202100268"
"28263836","Optical barcoding of PLGA for multispectral analysis of nanoparticle fate in vivo","Medina DX, Householder KT, Ceton R, Kovalik T, Heffernan JM, Shankar RV, Bowser RP, Wechsler-Reya RJ, Sirianni RW.","J Control Release. 2017 May 10;253:172-182. doi: 10.1016/j.jconrel.2017.02.033. Epub 2017 Mar 3.","Medina DX","J Control Release","2017","2017/03/07","","","10.1016/j.jconrel.2017.02.033"
"25667443","Complementarity of variable-magnification and spectral-separation fluorescence imaging systems for noninvasive detection of metastasis and intravital detection of single cancer cells in mouse models","Zhang Y, Hiroshima Y, Ma H, Zhang N, Zhao M, Hoffman RM.","Anticancer Res. 2015 Feb;35(2):661-7.","Zhang Y","Anticancer Res","2015","2015/02/11","","",""
"27566102","High-Resolution Multispectral Optoacoustic Tomography of the Vascularization and Constitutive Hypoxemia of Cancerous Tumors","Chekkoury A, Nunes A, Gateau J, Symvoulidis P, Feuchtinger A, Beziere N, Ovsepian SV, Walch A, Ntziachristos V.","Neoplasia. 2016 Aug;18(8):459-67. doi: 10.1016/j.neo.2016.06.004.","Chekkoury A","Neoplasia","2016","2016/08/28","PMC5018092","","10.1016/j.neo.2016.06.004"
"35699479","Non-invasive metabolic profiling of inflammation in joints and entheses by multispectral optoacoustic tomography","Tascilar K, Fagni F, Kleyer A, Bayat S, Heidemann R, Steiger F, Krönke G, Bohr D, Ramming A, Hartmann F, Klett D, Federle A, Regensburger AP, Wagner AL, Knieling F, Neurath MF, Schett G, Waldner M, Simon D.","Rheumatology (Oxford). 2023 Feb 1;62(2):841-849. doi: 10.1093/rheumatology/keac346.","Tascilar K","Rheumatology (Oxford)","2023","2022/06/14","","","10.1093/rheumatology/keac346"
"26848506","Real-Time Fluorescence Tracking of Protoporphyrin Incorporated Thermosensitive Hydrogel and Its Drug Release in Vivo","Dong X, Wei C, Liu T, Lv F, Qian Z.","ACS Appl Mater Interfaces. 2016 Mar 2;8(8):5104-13. doi: 10.1021/acsami.5b11493. Epub 2016 Feb 16.","Dong X","ACS Appl Mater Interfaces","2016","2016/02/06","","","10.1021/acsami.5b11493"
"28540184","Detection of intramyocardially injected DiR-labeled mesenchymal stem cells by optical and optoacoustic tomography","Berninger MT, Mohajerani P, Wildgruber M, Beziere N, Kimm MA, Ma X, Haller B, Fleming MJ, Vogt S, Anton M, Imhoff AB, Ntziachristos V, Meier R, Henning TD.","Photoacoustics. 2017 May 4;6:37-47. doi: 10.1016/j.pacs.2017.04.002. eCollection 2017 Jun.","Berninger MT","Photoacoustics","2017","2017/05/26","PMC5430154","","10.1016/j.pacs.2017.04.002"
"32550903","S-nitrosothiols loaded mini-sized Au@silica nanorod elicits collagen depletion and mitochondrial damage in solid tumor treatment","Liu P, Wang Y, Liu Y, Tan F, Li J, Li N.","Theranostics. 2020 May 20;10(15):6774-6789. doi: 10.7150/thno.42661. eCollection 2020.","Liu P","Theranostics","2020","2020/06/20","PMC7295055","","10.7150/thno.42661"
"27054463","In Vivo Chemiluminescent Imaging Agents for Nitroreductase and Tissue Oxygenation","Cao J, Campbell J, Liu L, Mason RP, Lippert AR.","Anal Chem. 2016 May 3;88(9):4995-5002. doi: 10.1021/acs.analchem.6b01096. Epub 2016 Apr 15.","Cao J","Anal Chem","2016","2016/04/08","PMC5033617","NIHMS816051","10.1021/acs.analchem.6b01096"
"36589697","In Vivo Assessment and Monitoring of Burn Wounds Using a Handheld Terahertz Hyperspectral Scanner","Osman OB, Harris ZB, Zhou JW, Khani ME, Singer AJ, Arbab MH.","Adv Photonics Res. 2022 May;3(5):2100095. doi: 10.1002/adpr.202100095. Epub 2022 Jan 17.","Osman OB","Adv Photonics Res","2022","2023/01/02","PMC9797155","NIHMS1772841","10.1002/adpr.202100095"
"28755860","Dynamic and accurate assessment of acetaminophen-induced hepatotoxicity by integrated photoacoustic imaging and mechanistic biomarkers in vivo","Brillant N, Elmasry M, Burton NC, Rodriguez JM, Sharkey JW, Fenwick S, Poptani H, Kitteringham NR, Goldring CE, Kipar A, Park BK, Antoine DJ.","Toxicol Appl Pharmacol. 2017 Oct 1;332:64-74. doi: 10.1016/j.taap.2017.07.019. Epub 2017 Jul 26.","Brillant N","Toxicol Appl Pharmacol","2017","2017/07/31","","","10.1016/j.taap.2017.07.019"
"32290487","Long-term Risk Assessment for Medical Application of Cold Atmospheric Pressure Plasma","Rutkowski R, Daeschlein G, von Woedtke T, Smeets R, Gosau M, Metelmann HR.","Diagnostics (Basel). 2020 Apr 11;10(4):210. doi: 10.3390/diagnostics10040210.","Rutkowski R","Diagnostics (Basel)","2020","2020/04/16","PMC7235715","","10.3390/diagnostics10040210"
"35575738","Noninvasive Measurement of Oxygen Saturation in Human Retinal Blood Vessels and Tissues With Multispectral Confocal Imaging","Khoobehi B, Wafapoor H, Eaton A, Liu R, Firn K, Kubilay T.","Ophthalmic Surg Lasers Imaging Retina. 2022 May;53(5):275-283. doi: 10.3928/23258160-20220420-01. Epub 2022 May 1.","Khoobehi B","Ophthalmic Surg Lasers Imaging Retina","2022","2022/05/16","","","10.3928/23258160-20220420-01"
"36052742","Dual near-infrared II laser modulates the cellular redox state of T cells and augments the efficacy of cancer immunotherapy","Katagiri W, Yokomizo S, Ishizuka T, Yamashita K, Kopp T, Roessing M, Sato A, Iwasaki T, Sato H, Fukuda T, Monaco H, Manganiello S, Nomura S, Ng MR, Feil S, Ogawa E, Fukumura D, Atochin DN, Choi HS, Kashiwagi S.","FASEB J. 2022 Oct;36(10):e22521. doi: 10.1096/fj.202200033R.","Katagiri W","FASEB J","2022","2022/09/02","PMC9574655","NIHMS1840326","10.1096/fj.202200033R"
"33309846","Understanding the role of colon-specific microparticles based on retrograded starch/pectin in the delivery of chitosan nanoparticles along the gastrointestinal tract","Dos Santos AM, Meneguin AB, Akhter DT, Fletcher N, Houston ZH, Bell C, Thurecht KJ, Gremião MPD.","Eur J Pharm Biopharm. 2021 Jan;158:371-378. doi: 10.1016/j.ejpb.2020.12.004. Epub 2020 Dec 10.","Dos Santos AM","Eur J Pharm Biopharm","2021","2020/12/14","","","10.1016/j.ejpb.2020.12.004"
"32226306","Noninvasive monitoring of liver metastasis development via combined multispectral photoacoustic imaging and fluorescence diffuse optical tomography","Lavaud J, Henry M, Gayet P, Fertin A, Vollaire J, Usson Y, Coll JL, Josserand V.","Int J Biol Sci. 2020 Mar 12;16(9):1616-1628. doi: 10.7150/ijbs.40896. eCollection 2020.","Lavaud J","Int J Biol Sci","2020","2020/04/01","PMC7097915","","10.7150/ijbs.40896"
"20199661","Multifunctional Nanocarriers for diagnostics, drug delivery and targeted treatment across blood-brain barrier: perspectives on tracking and neuroimaging","Bhaskar S, Tian F, Stoeger T, Kreyling W, de la Fuente JM, Grazú V, Borm P, Estrada G, Ntziachristos V, Razansky D.","Part Fibre Toxicol. 2010 Mar 3;7:3. doi: 10.1186/1743-8977-7-3.","Bhaskar S","Part Fibre Toxicol","2010","2010/03/05","PMC2847536","","10.1186/1743-8977-7-3"
"30867835","Real-Time Monitoring of Pharmacokinetics of Antibiotics in Biofilms with Raman-Tagged Hyperspectral Stimulated Raman Scattering Microscopy","Bae K, Zheng W, Ma Y, Huang Z.","Theranostics. 2019 Feb 14;9(5):1348-1357. doi: 10.7150/thno.32043. eCollection 2019.","Bae K","Theranostics","2019","2019/03/15","PMC6401501","","10.7150/thno.32043"
