PMID,Title,Authors,Citation,First Author,Journal/Book,Publication Year,Create Date,PMCID,NIHMS ID,DOI
"20175496","In vivo bioluminescence tomography with a blocking-off finite-difference SP3 method and MRI/CT coregistration","Klose AD, Beattie BJ, Dehghani H, Vider L, Le C, Ponomarev V, Blasberg R.","Med Phys. 2010 Jan;37(1):329-38. doi: 10.1118/1.3273034.","Klose AD","Med Phys","2010","2010/02/24","PMC2803718","","10.1118/1.3273034"
"25364949","In vivo near-infrared fluorescence three-dimensional positioning system with binocular stereovision","Song B, Jin W, Wang Y, Jin Q, Mu Y.","J Biomed Opt. 2014;19(11):116002. doi: 10.1117/1.JBO.19.11.116002.","Song B","J Biomed Opt","2014","2014/11/04","","","10.1117/1.JBO.19.11.116002"
"22352662","Multispectral reflectance imaging of brain activation in rodents: methodological study of the differential path length estimations and first in vivo recordings in the rat olfactory bulb","Renaud R, Martin C, Gurden H, Pain F.","J Biomed Opt. 2012 Jan;17(1):016012. doi: 10.1117/1.JBO.17.1.016012.","Renaud R","J Biomed Opt","2012","2012/02/23","","","10.1117/1.JBO.17.1.016012"
"28652976","Noninvasive real-time characterization of non-melanoma skin cancers with handheld optoacoustic probes","Attia ABE, Chuah SY, Razansky D, Ho CJH, Malempati P, Dinish US, Bi R, Fu CY, Ford SJ, Lee JS, Tan MWP, Olivo M, Thng STG.","Photoacoustics. 2017 Jun 4;7:20-26. doi: 10.1016/j.pacs.2017.05.003. eCollection 2017 Sep.","Attia ABE","Photoacoustics","2017","2017/06/28","PMC5473546","","10.1016/j.pacs.2017.05.003"
"30900114","Estimation of tissue oxygen saturation from RGB images and sparse hyperspectral signals based on conditional generative adversarial network","Li Q, Lin J, Clancy NT, Elson DS.","Int J Comput Assist Radiol Surg. 2019 Jun;14(6):987-995. doi: 10.1007/s11548-019-01940-2. Epub 2019 Mar 21.","Li Q","Int J Comput Assist Radiol Surg","2019","2019/03/23","PMC6544606","","10.1007/s11548-019-01940-2"
"27044607","A four-dimensional snapshot hyperspectral video-endoscope for bio-imaging applications","Lim HT, Murukeshan VM.","Sci Rep. 2016 Apr 5;6:24044. doi: 10.1038/srep24044.","Lim HT","Sci Rep","2016","2016/04/06","PMC4820774","","10.1038/srep24044"
"35756897","Multiparametric Radiomics for Predicting the Aggressiveness of Papillary Thyroid Carcinoma Using Hyperspectral Images","Edwards K, Halicek M, Little JV, Chen AY, Fei B.","Proc SPIE Int Soc Opt Eng. 2021 Feb;11597:1159728. doi: 10.1117/12.2582147. Epub 2021 Feb 15.","Edwards K","Proc SPIE Int Soc Opt Eng","2021","2022/06/27","PMC9232190","NIHMS1762470","10.1117/12.2582147"
"19143057","Optical imaging for cervical cancer detection: solutions for a continuing global problem","Thekkek N, Richards-Kortum R.","Nat Rev Cancer. 2008 Sep;8(9):725-31. doi: 10.1038/nrc2462.","Thekkek N","Nat Rev Cancer","2008","2009/01/15","PMC2633464","NIHMS89517","10.1038/nrc2462"
"28786007","Multispectral optoacoustic tomography of the human breast: characterisation of healthy tissue and malignant lesions using a hybrid ultrasound-optoacoustic approach","Becker A, Masthoff M, Claussen J, Ford SJ, Roll W, Burg M, Barth PJ, Heindel W, Schäfers M, Eisenblätter M, Wildgruber M.","Eur Radiol. 2018 Feb;28(2):602-609. doi: 10.1007/s00330-017-5002-x. Epub 2017 Aug 7.","Becker A","Eur Radiol","2018","2017/08/09","","","10.1007/s00330-017-5002-x"
"29554126","Spatio-spectral classification of hyperspectral images for brain cancer detection during surgical operations","Fabelo H, Ortega S, Ravi D, Kiran BR, Sosa C, Bulters D, Callicó GM, Bulstrode H, Szolna A, Piñeiro JF, Kabwama S, Madroñal D, Lazcano R, J-O'Shanahan A, Bisshopp S, Hernández M, Báez A, Yang GZ, Stanciulescu B, Salvador R, Juárez E, Sarmiento R.","PLoS One. 2018 Mar 19;13(3):e0193721. doi: 10.1371/journal.pone.0193721. eCollection 2018.","Fabelo H","PLoS One","2018","2018/03/20","PMC5858847","","10.1371/journal.pone.0193721"
"33251378","Mapping 2D- and 3D-distributions of metal/metal oxide nanoparticles within cleared human ex vivo skin tissues","Touloumes GJ, Ardoña HAM, Casalino EK, Zimmerman JF, Chantre CO, Bitounis D, Demokritou P, Parker KK.","NanoImpact. 2020 Jan;17:100208. doi: 10.1016/j.impact.2020.100208. Epub 2020 Jan 13.","Touloumes GJ","NanoImpact","2020","2020/11/30","PMC7687853","NIHMS1556883","10.1016/j.impact.2020.100208"
"28899968","Multispectral Optoacoustic Tomography (MSOT) of Human Breast Cancer","Diot G, Metz S, Noske A, Liapis E, Schroeder B, Ovsepian SV, Meier R, Rummeny E, Ntziachristos V.","Clin Cancer Res. 2017 Nov 15;23(22):6912-6922. doi: 10.1158/1078-0432.CCR-16-3200. Epub 2017 Sep 12.","Diot G","Clin Cancer Res","2017","2017/09/14","","","10.1158/1078-0432.CCR-16-3200"
"31522461","Toward assessment of resection margins using hyperspectral diffuse reflection imaging (400-1,700 nm) during tongue cancer surgery","Brouwer de Koning SG, Weijtmans P, Karakullukcu MB, Shan C, Baltussen EJM, Smit LA, van Veen RLP, Hendriks BHW, Sterenborg HJCM, Ruers TJM.","Lasers Surg Med. 2020 Jul;52(6):496-502. doi: 10.1002/lsm.23161. Epub 2019 Sep 15.","Brouwer de Koning SG","Lasers Surg Med","2020","2019/09/16","","","10.1002/lsm.23161"
"25439222","Orthotopic pancreatic tumors detected by optoacoustic tomography using Syndecan-1","Kimbrough CW, Hudson S, Khanal A, Egger ME, McNally LR.","J Surg Res. 2015 Jan;193(1):246-54. doi: 10.1016/j.jss.2014.06.045. Epub 2014 Oct 13.","Kimbrough CW","J Surg Res","2015","2014/12/03","PMC4268324","NIHMS634942","10.1016/j.jss.2014.06.045"
"30813245","Deep Learning-Based Framework for In Vivo Identification of Glioblastoma Tumor using Hyperspectral Images of Human Brain","Fabelo H, Halicek M, Ortega S, Shahedi M, Szolna A, Piñeiro JF, Sosa C, O'Shanahan AJ, Bisshopp S, Espino C, Márquez M, Hernández M, Carrera D, Morera J, Callico GM, Sarmiento R, Fei B.","Sensors (Basel). 2019 Feb 22;19(4):920. doi: 10.3390/s19040920.","Fabelo H","Sensors (Basel)","2019","2019/03/01","PMC6412736","","10.3390/s19040920"
"29736563","Multispectral Photoacoustic Imaging of Tumor Protease Activity with a Gold Nanocage-Based Activatable Probe","Liu C, Li S, Gu Y, Xiong H, Wong WT, Sun L.","Mol Imaging Biol. 2018 Dec;20(6):919-929. doi: 10.1007/s11307-018-1203-1.","Liu C","Mol Imaging Biol","2018","2018/05/09","","","10.1007/s11307-018-1203-1"
"25360354","A polarized multispectral imaging system for quantitative assessment of hypertrophic scars","Ghassemi P, Travis TE, Moffatt LT, Shupp JW, Ramella-Roman JC.","Biomed Opt Express. 2014 Sep 2;5(10):3337-54. doi: 10.1364/BOE.5.003337. eCollection 2014 Oct 1.","Ghassemi P","Biomed Opt Express","2014","2014/11/01","PMC4206306","","10.1364/BOE.5.003337"
"28669429","Hybrid Photoacoustic/Ultrasound Tomograph for Real-Time Finger Imaging","Oeri M, Bost W, Sénégond N, Tretbar S, Fournelle M.","Ultrasound Med Biol. 2017 Oct;43(10):2200-2212. doi: 10.1016/j.ultrasmedbio.2017.05.015. Epub 2017 Jun 29.","Oeri M","Ultrasound Med Biol","2017","2017/07/04","","","10.1016/j.ultrasmedbio.2017.05.015"
"27752519","Intraoperative video-rate hemodynamic response assessment in human cortex using snapshot hyperspectral optical imaging","Pichette J, Laurence A, Angulo L, Lesage F, Bouthillier A, Nguyen DK, Leblond F.","Neurophotonics. 2016 Oct;3(4):045003. doi: 10.1117/1.NPh.3.4.045003. Epub 2016 Oct 12.","Pichette J","Neurophotonics","2016","2016/10/19","PMC5061108","","10.1117/1.NPh.3.4.045003"
"32746111","Deep Learning-Based Spectral Unmixing for Optoacoustic Imaging of Tissue Oxygen Saturation","Olefir I, Tzoumas S, Restivo C, Mohajerani P, Xing L, Ntziachristos V.","IEEE Trans Med Imaging. 2020 Nov;39(11):3643-3654. doi: 10.1109/TMI.2020.3001750. Epub 2020 Oct 28.","Olefir I","IEEE Trans Med Imaging","2020","2020/08/04","PMC7671861","NIHMS1637610","10.1109/TMI.2020.3001750"
"28267921","Oxygen Nanobubble Tracking by Light Scattering in Single Cells and Tissues","Bhandari P, Wang X, Irudayaraj J.","ACS Nano. 2017 Mar 28;11(3):2682-2688. doi: 10.1021/acsnano.6b07478. Epub 2017 Mar 13.","Bhandari P","ACS Nano","2017","2017/03/08","","","10.1021/acsnano.6b07478"
"21603623","Spectral characterization and unmixing of intrinsic contrast in intact normal and diseased gastric tissues using hyperspectral two-photon microscopy","Grosberg LE, Radosevich AJ, Asfaha S, Wang TC, Hillman EM.","PLoS One. 2011;6(5):e19925. doi: 10.1371/journal.pone.0019925. Epub 2011 May 16.","Grosberg LE","PLoS One","2011","2011/05/24","PMC3095627","","10.1371/journal.pone.0019925"
"26100122","Robust surface tracking combining features, intensity and illumination compensation","Du X, Clancy N, Arya S, Hanna GB, Kelly J, Elson DS, Stoyanov D.","Int J Comput Assist Radiol Surg. 2015 Dec;10(12):1915-26. doi: 10.1007/s11548-015-1243-9. Epub 2015 Jun 24.","Du X","Int J Comput Assist Radiol Surg","2015","2015/06/24","","","10.1007/s11548-015-1243-9"
"30587977","Multispectral optoacoustic tomography (MSOT) for imaging the particle size-dependent intratumoral distribution of polymeric micelles","Cong Z, Yang F, Cao L, Wen H, Fu T, Ma S, Liu C, Quan L, Liao Y.","Int J Nanomedicine. 2018 Dec 12;13:8549-8560. doi: 10.2147/IJN.S185726. eCollection 2018.","Cong Z","Int J Nanomedicine","2018","2018/12/28","PMC6296692","","10.2147/IJN.S185726"
"33010515","Gold nanorods enable noninvasive longitudinal monitoring of hydrogels in vivo with photoacoustic tomography","Shrestha B, Stojkova K, Yi R, Anastasio MA, Ye JY, Brey EM.","Acta Biomater. 2020 Nov;117:374-383. doi: 10.1016/j.actbio.2020.09.048. Epub 2020 Sep 30.","Shrestha B","Acta Biomater","2020","2020/10/03","","","10.1016/j.actbio.2020.09.048"
"26309761","Rapid multispectral endoscopic imaging system for near real-time mapping of the mucosa blood supply in the lung","Fawzy Y, Lam S, Zeng H.","Biomed Opt Express. 2015 Jul 21;6(8):2980-90. doi: 10.1364/BOE.6.002980. eCollection 2015 Aug 1.","Fawzy Y","Biomed Opt Express","2015","2015/08/27","PMC4541525","","10.1364/BOE.6.002980"
"36726664","Signal to noise ratio quantifies the contribution of spectral channels to classification of human head and neck tissues ex vivo using deep learning and multispectral imaging","Liu GS, Shenson JA, Farrell JE, Blevins NH.","J Biomed Opt. 2023 Jan;28(1):016004. doi: 10.1117/1.JBO.28.1.016004. Epub 2023 Jan 28.","Liu GS","J Biomed Opt","2023","2023/02/02","PMC9884103","","10.1117/1.JBO.28.1.016004"
"25327410","Multispectral optoacoustic tomography of myocardial infarction","Taruttis A, Wildgruber M, Kosanke K, Beziere N, Licha K, Haag R, Aichler M, Walch A, Rummeny E, Ntziachristos V.","Photoacoustics. 2012 Dec 10;1(1):3-8. doi: 10.1016/j.pacs.2012.11.001. eCollection 2013 Mar.","Taruttis A","Photoacoustics","2012","2014/10/21","PMC4182822","","10.1016/j.pacs.2012.11.001"
"16479602","In vivo cytometry: a spectrum of possibilities","Chung A, Karlan S, Lindsley E, Wachsmann-Hogiu S, Farkas DL.","Cytometry A. 2006 Mar;69(3):142-6. doi: 10.1002/cyto.a.20220.","Chung A","Cytometry A","2006","2006/02/16","","","10.1002/cyto.a.20220"
"31887006","Multimodal Nanocarrier Probes Reveal Superior Biodistribution Quantification by Isotopic Analysis over Fluorescence","Deng H, Konopka CJ, Cross TL, Swanson KS, Dobrucki LW, Smith AM.","ACS Nano. 2020 Jan 28;14(1):509-523. doi: 10.1021/acsnano.9b06504. Epub 2020 Jan 7.","Deng H","ACS Nano","2020","2019/12/31","PMC7377915","NIHMS1606755","10.1021/acsnano.9b06504"
"33108958","Short-term oral administration of non-porous and mesoporous silica did not induce local or systemic toxicity in mice","Cabellos J, Gimeno-Benito I, Catalán J, Lindberg HK, Vales G, Fernandez-Rosas E, Ghemis R, Jensen KA, Atluri R, Vázquez-Campos S, Janer G.","Nanotoxicology. 2020 Dec;14(10):1324-1341. doi: 10.1080/17435390.2020.1818325. Epub 2020 Oct 28.","Cabellos J","Nanotoxicology","2020","2020/10/28","","","10.1080/17435390.2020.1818325"
"28615944","The interactions of single-wall carbon nanohorns with polar epithelium","Shi Y, Shi Z, Li S, Zhang Y, He B, Peng D, Tian J, Zhao M, Wang X, Zhang Q.","Int J Nanomedicine. 2017 Jun 1;12:4177-4194. doi: 10.2147/IJN.S133295. eCollection 2017.","Shi Y","Int J Nanomedicine","2017","2017/06/16","PMC5459976","","10.2147/IJN.S133295"
"20835767","Intraoperative multispectral fluorescence imaging for the detection of the sentinel lymph node in cervical cancer: a novel concept","Crane LM, Themelis G, Pleijhuis RG, Harlaar NJ, Sarantopoulos A, Arts HJ, van der Zee AG, Ntziachristos V, van Dam GM.","Mol Imaging Biol. 2011 Oct;13(5):1043-9. doi: 10.1007/s11307-010-0425-7.","Crane LM","Mol Imaging Biol","2011","2010/09/14","PMC3179588","","10.1007/s11307-010-0425-7"
"12607839","Automated melanoma detection: multispectral imaging and neural network approach for classification","Tomatis S, Bono A, Bartoli C, Carrara M, Lualdi M, Tragni G, Marchesini R.","Med Phys. 2003 Feb;30(2):212-21. doi: 10.1118/1.1538230.","Tomatis S","Med Phys","2003","2003/02/28","","","10.1118/1.1538230"
"35515105","Synthetic MRI for Radiotherapy Planning for Brain and Prostate Cancers: Phantom Validation and Patient Evaluation","Gouel P, Hapdey S, Dumouchel A, Gardin I, Torfeh E, Hinault P, Vera P, Thureau S, Gensanne D.","Front Oncol. 2022 Apr 20;12:841761. doi: 10.3389/fonc.2022.841761. eCollection 2022.","Gouel P","Front Oncol","2022","2022/05/06","PMC9065558","","10.3389/fonc.2022.841761"
"28237924","Bayesian Estimation of Intrinsic Tissue Oxygenation and Perfusion From RGB Images","Jones G, Clancy NT, Helo Y, Arridge S, Elson DS, Stoyanov D.","IEEE Trans Med Imaging. 2017 Jul;36(7):1491-1501. doi: 10.1109/TMI.2017.2665627. Epub 2017 Feb 20.","Jones G","IEEE Trans Med Imaging","2017","2017/02/27","","","10.1109/TMI.2017.2665627"
"25028587","Detection of melanoma metastases in resected human lymph nodes by noninvasive multispectral photoacoustic imaging","Langhout GC, Grootendorst DJ, Nieweg OE, Wouters MW, van der Hage JA, Jose J, van Boven H, Steenbergen W, Manohar S, Ruers TJ.","Int J Biomed Imaging. 2014;2014:163652. doi: 10.1155/2014/163652. Epub 2014 Jun 16.","Langhout GC","Int J Biomed Imaging","2014","2014/07/17","PMC4083597","","10.1155/2014/163652"
"23214186","Indocyanine-green-loaded microballoons for biliary imaging in cholecystectomy","Mitra K, Melvin J, Chang S, Park K, Yilmaz A, Melvin S, Xu RX.","J Biomed Opt. 2012 Nov;17(11):116025. doi: 10.1117/1.jbo.17.11.116025.","Mitra K","J Biomed Opt","2012","2012/12/11","PMC3500502","","10.1117/1.jbo.17.11.116025"
"25734405","Second derivative multispectral algorithm for quantitative assessment of cutaneous tissue oxygenation","Huang J, Zhang S, Gnyawali S, Sen CK, Xu RX.","J Biomed Opt. 2015 Mar;20(3):036001. doi: 10.1117/1.JBO.20.3.036001.","Huang J","J Biomed Opt","2015","2015/03/04","PMC4347514","","10.1117/1.JBO.20.3.036001"
"23576407","Phasor analysis of multiphoton spectral images distinguishes autofluorescence components of in vivo human skin","Fereidouni F, Bader AN, Colonna A, Gerritsen HC.","J Biophotonics. 2014 Aug;7(8):589-96. doi: 10.1002/jbio.201200244. Epub 2013 Apr 11.","Fereidouni F","J Biophotonics","2014","2013/04/12","","","10.1002/jbio.201200244"
"29774069","A large, switchable optical clearing skull window for cerebrovascular imaging","Zhang C, Feng W, Zhao Y, Yu T, Li P, Xu T, Luo Q, Zhu D.","Theranostics. 2018 Apr 9;8(10):2696-2708. doi: 10.7150/thno.23686. eCollection 2018.","Zhang C","Theranostics","2018","2018/05/19","PMC5957003","","10.7150/thno.23686"
"27536877","A hyperspectral method to assay the microphysiological fates of nanomaterials in histological samples","SoRelle ED, Liba O, Campbell JL, Dalal R, Zavaleta CL, de la Zerda A.","Elife. 2016 Aug 18;5:e16352. doi: 10.7554/eLife.16352.","SoRelle ED","Elife","2016","2016/08/19","PMC5042654","","10.7554/eLife.16352"
"27337713","Statistical Molecular Target Detection Framework for Multispectral Optoacoustic Tomography","Tzoumas S, Kravtsiv A, Gao Y, Buehler A, Ntziachristos V.","IEEE Trans Med Imaging. 2016 Dec;35(12):2534-2545. doi: 10.1109/TMI.2016.2583791. Epub 2016 Jun 22.","Tzoumas S","IEEE Trans Med Imaging","2016","2016/06/24","","","10.1109/TMI.2016.2583791"
"23133450","Rapid Stereomicroscopic Imaging of HER2 Overexpression in Ex Vivo Breast Tissue Using Topically Applied Silica-Based Gold Nanoshells","Bickford LR, Langsner RJ, Chang J, Kennedy LC, Agollah GD, Drezek R.","J Oncol. 2012;2012:291898. doi: 10.1155/2012/291898. Epub 2012 Oct 22.","Bickford LR","J Oncol","2012","2012/11/08","PMC3485548","","10.1155/2012/291898"
"30891357","High-resolution endomicroscopy with a spectrally encoded miniature objective","Jeon H, Pawlowski ME, Tkaczyk TS.","Biomed Opt Express. 2019 Feb 25;10(3):1432-1445. doi: 10.1364/BOE.10.001432. eCollection 2019 Mar 1.","Jeon H","Biomed Opt Express","2019","2019/03/21","PMC6420270","","10.1364/BOE.10.001432"
"24096299","High-resolution optoacoustic mesoscopy with a 24 MHz multidetector translate-rotate scanner","Gateau J, Chekkoury A, Ntziachristos V.","J Biomed Opt. 2013 Oct;18(10):106005. doi: 10.1117/1.JBO.18.10.106005.","Gateau J","J Biomed Opt","2013","2013/10/08","","","10.1117/1.JBO.18.10.106005"
"26659573","Metastatic status of sentinel lymph nodes in melanoma determined noninvasively with multispectral optoacoustic imaging","Stoffels I, Morscher S, Helfrich I, Hillen U, Leyh J, Burton NC, Sardella TC, Claussen J, Poeppel TD, Bachmann HS, Roesch A, Griewank K, Schadendorf D, Gunzer M, Klode J.","Sci Transl Med. 2015 Dec 9;7(317):317ra199. doi: 10.1126/scitranslmed.aad1278.","Stoffels I","Sci Transl Med","2015","2015/12/15","","","10.1126/scitranslmed.aad1278"
"19343636","Nonlinear laser imaging of skin lesions","Cicchi R, Sestini S, De Giorgi V, Massi D, Lotti T, Pavone FS.","J Biophotonics. 2008 Mar;1(1):62-73. doi: 10.1002/jbio.200710003.","Cicchi R","J Biophotonics","2008","2009/04/04","","","10.1002/jbio.200710003"
"23026761","Multispectral opto-acoustic tomography (MSOT) of the brain and glioblastoma characterization","Burton NC, Patel M, Morscher S, Driessen WH, Claussen J, Beziere N, Jetzfellner T, Taruttis A, Razansky D, Bednar B, Ntziachristos V.","Neuroimage. 2013 Jan 15;65:522-8. doi: 10.1016/j.neuroimage.2012.09.053. Epub 2012 Sep 28.","Burton NC","Neuroimage","2013","2012/10/03","","","10.1016/j.neuroimage.2012.09.053"
"29999204","Use of the NESMA Filter to Improve Myelin Water Fraction Mapping with Brain MRI","Bouhrara M, Reiter DA, Maring MC, Bonny JM, Spencer RG.","J Neuroimaging. 2018 Nov;28(6):640-649. doi: 10.1111/jon.12537. Epub 2018 Jul 12.","Bouhrara M","J Neuroimaging","2018","2018/07/13","PMC6212320","NIHMS976853","10.1111/jon.12537"
"21639573","Real-time snapshot hyperspectral imaging endoscope","Kester RT, Bedard N, Gao L, Tkaczyk TS.","J Biomed Opt. 2011 May;16(5):056005. doi: 10.1117/1.3574756.","Kester RT","J Biomed Opt","2011","2011/06/07","PMC3107836","","10.1117/1.3574756"
"15004796","Quantification of tumor tissue populations by multispectral analysis","Carano RA, Ross AL, Ross J, Williams SP, Koeppen H, Schwall RH, Van Bruggen N.","Magn Reson Med. 2004 Mar;51(3):542-51. doi: 10.1002/mrm.10731.","Carano RA","Magn Reson Med","2004","2004/03/09","","","10.1002/mrm.10731"
"25284265","Effects of multispectral excitation on the sensitivity of molecular optoacoustic imaging","Tzoumas S, Nunes A, Deliolanis NC, Ntziachristos V.","J Biophotonics. 2015 Aug;8(8):629-37. doi: 10.1002/jbio.201400056. Epub 2014 Oct 3.","Tzoumas S","J Biophotonics","2015","2014/10/07","","","10.1002/jbio.201400056"
"34892018","Design of a Hyper-Spectral Imaging System for Gross Pathology of Pigmented Skin Lesions","Aloupogianni E, Ishikawa M, Ichimura T, Sasaki A, Kobayashi N, Obi T.","Annu Int Conf IEEE Eng Med Biol Soc. 2021 Nov;2021:3605-3608. doi: 10.1109/EMBC46164.2021.9629512.","Aloupogianni E","Annu Int Conf IEEE Eng Med Biol Soc","2021","2021/12/11","","","10.1109/EMBC46164.2021.9629512"
"29993443","Uncertainty-Aware Organ Classification for Surgical Data Science Applications in Laparoscopy","Moccia S, Wirkert SJ, Kenngott H, Vemuri AS, Apitz M, Mayer B, De Momi E, Mattos LS, Maier-Hein L.","IEEE Trans Biomed Eng. 2018 Nov;65(11):2649-2659. doi: 10.1109/TBME.2018.2813015. Epub 2018 Mar 9.","Moccia S","IEEE Trans Biomed Eng","2018","2018/07/12","","","10.1109/TBME.2018.2813015"
"24980413","Multispectral upconversion luminescence intensity ratios for ascertaining the tissue imaging depth","Liu K, Wang Y, Kong X, Liu X, Zhang Y, Tu L, Ding Y, Aalders MC, Buma WJ, Zhang H.","Nanoscale. 2014 Aug 7;6(15):9257-63. doi: 10.1039/c4nr02090a.","Liu K","Nanoscale","2014","2014/07/02","","","10.1039/c4nr02090a"
"24912616","Assessing in vitro stem-cell function and tracking engraftment of stem cells in ischaemic hearts by using novel iRFP gene labelling","Wang Y, Zhou M, Wang X, Qin G, Weintraub NL, Tang Y.","J Cell Mol Med. 2014 Sep;18(9):1889-94. doi: 10.1111/jcmm.12321. Epub 2014 Jun 9.","Wang Y","J Cell Mol Med","2014","2014/06/11","PMC4162818","NIHMS585588","10.1111/jcmm.12321"
"23478783","Imaging high-intensity focused ultrasound-induced tissue denaturation by multispectral photoacoustic method: an ex vivo study","Sun Y, O'Neill B.","Appl Opt. 2013 Mar 10;52(8):1764-70. doi: 10.1364/AO.52.001764.","Sun Y","Appl Opt","2013","2013/03/13","","","10.1364/AO.52.001764"
"26580699","Interventional multispectral photoacoustic imaging with a clinical ultrasound probe for discriminating nerves and tendons: an ex vivo pilot study","Mari JM, Xia W, West SJ, Desjardins AE.","J Biomed Opt. 2015 Nov;20(11):110503. doi: 10.1117/1.JBO.20.11.110503.","Mari JM","J Biomed Opt","2015","2015/11/19","PMC5217182","EMS70803","10.1117/1.JBO.20.11.110503"
"17048103","Remote non-invasive stereoscopic imaging of blood vessels: first in-vivo results of a new multispectral contrast enhancement technology","Wieringa FP, Mastik F, Cate FJ, Neumann HA, van der Steen AF.","Ann Biomed Eng. 2006 Dec;34(12):1870-8. doi: 10.1007/s10439-006-9198-1. Epub 2006 Oct 12.","Wieringa FP","Ann Biomed Eng","2006","2006/10/19","PMC1705509","","10.1007/s10439-006-9198-1"
"32859761","Characterization and validation of a preventative therapy for hypertrophic cardiomyopathy in a murine model of the disease","Viola HM, Shah AA, Johnstone VPA, Cserne Szappanos H, Hodson MP, Hool LC.","Proc Natl Acad Sci U S A. 2020 Sep 15;117(37):23113-23124. doi: 10.1073/pnas.2002976117. Epub 2020 Aug 28.","Viola HM","Proc Natl Acad Sci U S A","2020","2020/08/30","PMC7502707","","10.1073/pnas.2002976117"
"31673616","Advanced multispectral image-processing endoscopy system for visualizing two-dimensional hemoglobin saturation and relative hemoglobin concentration","Chiba T, Obara Y, Murata M, Akahoshi T.","Endosc Int Open. 2019 Nov;7(11):E1442-E1447. doi: 10.1055/a-0990-9189. Epub 2019 Oct 22.","Chiba T","Endosc Int Open","2019","2019/11/02","PMC6805204","","10.1055/a-0990-9189"
"25104414","Multispectral measurement of contrast in tissue-mimicking phantoms in near-infrared spectral range of 650 to 1600 nm","Salo D, Zhang H, Kim DM, Berezin MY.","J Biomed Opt. 2014 Aug;19(8):086008. doi: 10.1117/1.JBO.19.8.086008.","Salo D","J Biomed Opt","2014","2014/08/09","PMC4407673","","10.1117/1.JBO.19.8.086008"
"30260254","Osteopontin-targeted probe detects orthotopic breast cancers using optoacoustic imaging","Samykutty A, Thomas A, McNally M, Chiba A, McNally LR.","Biotech Histochem. 2018;93(8):608-614. doi: 10.1080/10520295.2018.1514466. Epub 2018 Sep 27.","Samykutty A","Biotech Histochem","2018","2018/09/28","PMC6407125","NIHMS1514528","10.1080/10520295.2018.1514466"
"23966226","Mitigating fluorescence spectral overlap in wide-field endoscopic imaging","Yang C, Hou V, Nelson LY, Seibel EJ.","J Biomed Opt. 2013 Aug;18(8):86012. doi: 10.1117/1.JBO.18.8.086012.","Yang C","J Biomed Opt","2013","2013/08/23","PMC3767456","","10.1117/1.JBO.18.8.086012"
"20059249","In-vivo fluorescence imaging with a multivariate curve resolution spectral unmixing technique","Xu H, Rice BW.","J Biomed Opt. 2009 Nov-Dec;14(6):064011. doi: 10.1117/1.3258838.","Xu H","J Biomed Opt","2009","2010/01/12","","","10.1117/1.3258838"
"22791572","Compressed-sensing multispectral imaging of the postoperative spine","Worters PW, Sung K, Stevens KJ, Koch KM, Hargreaves BA.","J Magn Reson Imaging. 2013 Jan;37(1):243-8. doi: 10.1002/jmri.23750. Epub 2012 Jul 12.","Worters PW","J Magn Reson Imaging","2013","2012/07/14","PMC3473176","NIHMS384619","10.1002/jmri.23750"
"24684208","Reliable cell segmentation based on spectral phasor analysis of hyperspectral stimulated Raman scattering imaging data","Fu D, Xie XS.","Anal Chem. 2014 May 6;86(9):4115-9. doi: 10.1021/ac500014b. Epub 2014 Apr 8.","Fu D","Anal Chem","2014","2014/04/02","","","10.1021/ac500014b"
"22890932","Tracking inflammation-induced mobilization of mesenchymal stem cells","Spaeth EL, Kidd S, Marini FC.","Methods Mol Biol. 2012;904:173-90. doi: 10.1007/978-1-61779-943-3_15.","Spaeth EL","Methods Mol Biol","2012","2012/08/15","","","10.1007/978-1-61779-943-3_15"
"28253387","Smartphone snapshot mapping of skin chromophores under triple-wavelength laser illumination","Spigulis J, Oshina I, Berzina A, Bykov A.","J Biomed Opt. 2017 Sep 1;22(9):91508. doi: 10.1117/1.JBO.22.9.091508.","Spigulis J","J Biomed Opt","2017","2017/03/03","","","10.1117/1.JBO.22.9.091508"
"27661454","Improved decision making for prioritizing tumor targeting antibodies in human xenografts: Utility of fluorescence imaging to verify tumor target expression, antibody binding and optimization of dosage and application schedule","Dobosz M, Haupt U, Scheuer W.","MAbs. 2017 Jan;9(1):140-153. doi: 10.1080/19420862.2016.1238996. Epub 2016 Sep 23.","Dobosz M","MAbs","2017","2016/09/24","PMC5240651","","10.1080/19420862.2016.1238996"
